,Owner,id,screenName,Text,company,i1,i2,i3,p1,p2,p3,t1,t2,t3,,
1182,aaron-harris,2.48E+017,WyzAnt,"Well, the #CTUstrike has ended, and kids are back in school! #Welcomeback #CPS. http://t.co/EbvDwkOI",tutorspree,2,4,3,4,4,3,4,5,6,,
1435,aaron-harris,2.16E+017,WyzAnt,Summer vacation: helpful or harmful? Let us know what you think &amp, read more here: http://t.co/tnRfy8df,tutorspree,6,6,6,8,6,5,6,4,4,
1669,aaron-harris,5562147017,WyzAnt,Tips for a successful first lesson for both students and tutors: http://bit.ly/eQ51S,tutorspree,3,5,3,7,5,5,5,8,5,,
1714,aaron-harris,3246123460,WyzAnt,"Tips for teaching frustrated students. Thanks, Kathryn! http://tinyurl.com/qrwgk4",tutorspree,6,8,7,7,7,7,9,7,8,,
1938,aaron-raddon,786480845,araddon,Ugh! Headed into dentist!,lytics,3,4,4,5,3,3,7,9,8,,
2184,abel-cuskelly,1.29E+017,Cuskelly,The intuitive mind is a sacred gift. #TED Talk by Iain McGilchrist on the evolution of our left and right hemispheres. http://t.co/GzBiRKFF,pogoseat,2,5,4,2,5,3,7,5,5,,
3264,adam-benayoun,2.98E+016,adambn,blocking ads on techcrunch? lame...,binpress,3,3,5,8,5,6,7,5,6,,
3906,adam-benayoun,2157743260,adambn,"John Coltrane ??? ""Wise One"" ??? http://blip.fm/~86876",binpress,3,6,4,2,3,4,2,4,4,,
6794,adam-bonnifield,4.71E+016,adamsfallen,"#mailchimp would be cooler if it tried to be less cool. surprisingly, turns out monkeys are not good at explaining list management.",spinnakr,5,8,6,4,2,5,8,7,5,,
7206,adam-breckler,3.92E+017,adambreckler,My answer to What is the difference between Growth Hacker and Product Manager? http://t.co/taYz0rLxnu,visual-ly,4,3,3,8,6,3,8,6,3,,
7255,adam-ghetti,5.14E+017,AdamGhetti,Nothing like prime factorization at 2am Sunday night!,ionic-security,2,1,4,1,3,4,3,5,4,,
8348,adam-odessky,3.29E+017,Sense_ly,"People Empathize With Robots - but more with humans. How about avatars then?

http://t.co/FBl2mPtd4g",sense-ly,4,5,6,7,7,6,8,8,8,,
9492,adam-saint,11330019923,adamjsaint,Enjoying the new Hybrid album. Check it out if you care for orchestral electronic music.,10sheet,3,3,5,6,5,5,4,6,5,,
10575,adam-wiggins,4.09E+017,hirodusk,"???A product team that is numb to feedback will never learn about their failed launches, their confusing UI, or ?????? http://t.co/7SPeHzRzpT",heroku,7,5,4,7,7,3,6,3,4,,
10669,adam-wiggins,3.88E+017,hirodusk,???I really believe that small companies don't fire people enough and that startup employees don't leave often enough.??? http://t.co/frbG37pM9a,heroku,5,4,4,6,5,3,4,5,4,,
10824,adam-wiggins,3.6E+017,hirodusk,Rather fasciated by this series of posts on ATM skimmers: https://t.co/QrKmGWRooK,heroku,2,3,4,4,7,5,5,7,4,,
11231,adam-wiggins,3.16E+017,hirodusk,"I can't believe I'm about to utter these words, but???



This org chart is awesome. http://t.co/fp4H4E795R",heroku,3,5,2,5,6,4,6,6,5,,
11251,adam-wiggins,3.12E+017,hirodusk,"Android developers' browsing habits analyzed: http://t.co/wpCPz2ff2C ??? tl;dr, Stack Overflow beats official docs.",heroku,2,4,2,7,5,6,5,4,6,,
11314,adam-wiggins,3.02E+017,hirodusk,"A shame the ""select text to quote"" feature seems to have gotten lost in one of the recent GMail redesigns.",heroku,4,5,4,5,3,4,3,6,4,,
11876,adam-wiggins,1.42E+016,hirodusk,"""Almost every technology follows this lifecycle: fantastic hackability at first and maturing into dependability.""  http://j.mp/8XOUUK",heroku,7,5,6,9,8,6,6,4,6,,
11879,adam-wiggins,1.16E+016,hirodusk,Conductive thread gloves: http://www.dotsgloves.com/,heroku,5,6,7,6,4,6,5,7,5,,
11985,adam-wiggins,18019730275,hirodusk,"""All I've had today is like.... six gummy bears and some scotch."" http://www.fxnetworks.com/shows/originals/archer/",heroku,2,3,4,2,1,4,7,5,4,,
12165,adam-wiggins,4853838168,hirodusk,You cannot succeed without the discipline of potential failure.  (paraphrased from http://bit.ly/1Qt0Qf),heroku,3,1,4,9,3,5,8,4,4,,
12196,adam-wiggins,3567761827,hirodusk,"""Competition is the freedom to act differently from others"" http://bit.ly/hMekE",heroku,2,1,3,7,9,6,4,3,7,,
12542,aditya-rathnam,4.47E+017,arathnam,"I'm on a panel at the PingWest event at PARISOMA at 6pm tonight - come on by!

http://t.co/QQ68J9ETA8",kamcord,8,9,4,8,6,4,8,8,6,,
14706,ajit-varma,3.48E+016,ajitvarma,You gotta get 152 inches - http://panasonic.net/proplasma/152_plasma/152inch.html,adku,6,3,5,3,4,5,5,5,5,,
14893,ajoy-sojan,1126809413,aj0y,is coffee good or bad?...hmmm..,quartzy,2,3,4,5,6,5,8,9,7,,
16307,al-bsharah,6695262831,ALBsharah,"Wide awake at 3:30AM. An hour later & I decided to get out of bed. If I made the laws, I'd be going to jail right now.",embarke,2,2,3,6,4,7,4,3,5,,
16937,al-bsharah,989621187,ALBsharah,Random garage voting FTW. In and out in 10 minutes!,embarke,9,7,5,4,9,5,9,7,5,,
18006,alan-downie,4.13E+017,alandownie,PlayDoh. Worst invention since Carpet.,bugherd,8,9,6,5,5,5,7,3,5,,
18246,alan-downie,3.91E+017,alandownie,"I don't like Pokemon, but I like data: http://t.co/fDQPmc0AmG",bugherd,2,1,3,8,6,7,5,5,6,,
21062,alban-denoyel,5.32E+017,Sketchfab,"""WineMaker House by Hoolss &amp; Mekel"" by mekel https://t.co/bOMKUSMm1Q #staffpick",sketchfab,6,8,6,3,5,4,2,1,4,,
21422,alban-denoyel,5.21E+017,Sketchfab,"""?????????????? ?? ??????????"" by lepdecor https://t.co/CjiLAa1k0J #staffpick http://t.co/cSx5OPFRia",sketchfab,2,3,1,2,2,1,2,2,1,,
21610,alban-denoyel,5.13E+017,Sketchfab,"""Goo Gunners Cowborg"" by monzombo https://t.co/BswvoGT8AI #staffpick",sketchfab,2,3,2,3,2,2,2,3,2,,
22138,alban-denoyel,4.96E+017,Sketchfab,Great use of the annotations on the detailed 3D cell by JussimirPasold http://t.co/rM9YMUctJE #staffpick http://t.co/LLmBIES0BQ,sketchfab,2,4,3,4,5,4,3,7,3,,
22875,alban-denoyel,4.7E+017,Sketchfab,White Rhino by baushkin just added to staff picks. http://t.co/qIwBAJnmqf,sketchfab,2,8,6,5,4,6,6,4,5,,
23641,alberto-arias-maestro,4.95E+017,thinkelastic,AWS Auto Scaling and Load Balancing Made Easy | ElasticBox http://t.co/qU7M7vrL6O,elasticbox,7,7,6,4,6,5,5,9,6,,
23675,alberto-arias-maestro,4.83E+017,thinkelastic,What If You Stopped Sleeping? http://t.co/b0B0BpmbKr,elasticbox,2,3,5,4,3,6,6,4,5,,
24152,ale-peti,3.82E+017,alesspetic,"How to become a Slovene, coffee: http://t.co/aadAyFTx2l",zemanta,3,2,4,8,6,7,8,7,6,,
24300,ale-peti,2.95E+017,alesspetic,Hello San Francisco! It's good to be back!,zemanta,4,7,6,3,7,6,5,8,6,,
25847,alejandro-russo,5.06E+017,russosays,Resting on #LaborDay is like fasting on Burger Day.,klooff,2,2,4,3,5,4,6,4,6,,
26952,alejandro-vazquez,5.04E+017,avazquez,HubSpot files to go public with a 100M IPO http://t.co/fQTyLWtqht,tienda-nube,5,7,7,9,8,7,8,4,7,,
27062,alejandro-vazquez,4.01E+017,avazquez,Business risks VS Personal risks - from The monk and the riddle http://t.co/f91mHSMrnU,tienda-nube,9,9,6,2,2,3,7,5,5,,
27232,alejandro-vazquez,3.46E+017,avazquez,A Look at Google's 200 Search Ranking Factors (Infographic): http://t.co/NGHdmCc1fZ,tienda-nube,5,6,4,7,6,4,6,4,4,,
27776,alejandro-vazquez,2.31E+017,avazquez,Ya comienzo un nuevo SABF! ??xitos para todo el equipo organizador y participantes! A disfrutar de estos tres d??as! #SABF2012,tienda-nube,2,1,2,1,1,2,1,2,2,,
29159,alejandro-vazquez,4635228553,avazquez,Semana Global del Emprendedorismo en Argentina: http://bit.ly/1PdZvJ #fb,tienda-nube,5,7,4,6,5,4,5,6,4,,
30654,alex-depledge,2.54E+017,adepledge,I tweeted that I woke up with my pjs the wrong way round this morning as Teddle :),hassle,2,4,2,6,5,5,5,2,4,,
31043,alex-devkar,3.48E+017,alexdevkar,"Duncan can obviously still play, but title window is closed on Spurs. Disappointing way to end for greatest power forward of all time.",conspire,6,9,7,7,7,6,8,9,7,,
31045,alex-devkar,3.47E+017,alexdevkar,"Not rooting for the Heat, but that Ray Allen 3 was about as pure as a shot can be.",conspire,3,3,6,3,4,5,6,5,5,,
34339,alex-negrea,3.22E+017,alexnnet,"Brand New Blog Post: The Art of Document Protection  http://t.co/Ig38dXmdwr

#document security #protection",doctrackr,4,6,4,6,5,5,5,4,5,,
35195,alexander-debelov,28879551887,adebelov1,"the new MySpace, very interesting: http://bit.ly/aEZxC1",virool,2,3,4,7,9,8,7,8,7,,
37534,alexis-l-quc,3.5E+016,alq,"Dear facebook, why is my profile picture aliased?",datadog,5,5,5,4,3,4,4,6,4,,
37862,alexis-l-quc,8469335972,alq,Sunset http://post.ly/LWPq,datadog,2,1,1,9,6,7,9,8,7,,
38428,alexis-l-quc,1033044147,alq,exit pownce... There's a smell of post-2000 in the air.,datadog,4,6,3,6,6,4,5,7,5,,
39132,alfred-gunnarsson,1.77E+017,salmiak,"Lyssnar p?? en ornitolog fr??n Sk??vde och konstaterar att jag i morgon kommer b??rja varje mening med ""Ja???"". Det verkar kul. #fb",brisk-io,2,2,2,2,3,2,2,3,2,,
39499,alfred-gunnarsson,6.14E+016,salmiak,Just posted a photo http://instagr.am/p/DZ9ED/,brisk-io,2,2,3,6,6,6,6,7,6,,
39584,alfred-gunnarsson,4.87E+016,salmiak,"""De kastade f??rg p?? polisen, ganska ball. Fast det var n??ra att jag fick f??rg p?? min jacka. Det ??r inte s?? solidariskt."" #fb",brisk-io,8,5,6,3,3,5,5,5,4,,
39736,alfred-gunnarsson,3.4E+016,salmiak,#mel2011 Dragspel och falsks??ng - nu ??r vi p?? topp!!!,brisk-io,7,6,6,6,8,5,4,7,5,,
40128,alfred-gunnarsson,29205202455,salmiak,"??r du i Malm??, kom till KB ??? det ??r h??r det h??nder. Snart Beyond Pink p?? scen. J??vla nice. #fb",brisk-io,2,1,1,2,3,1,2,2,1,,
40605,alfred-gunnarsson,20402275826,salmiak,S??h??r ser det ut under G??teborg.  http://yfrog.com/09b4boj http://yfrog.com/5g6n1ej http://yfrog.com/mg89fpj,brisk-io,2,4,2,2,1,2,1,3,2,,
41021,alfred-gunnarsson,16026359784,salmiak,Nu blir det t??rta.  http://yfrog.com/mg8x6j,brisk-io,3,5,3,3,4,4,3,2,4,,
41032,alfred-gunnarsson,15914934543,salmiak,Kan n??gon f??rklara varf??r bilderna jag la upp och taggade p?? Flickr f??r n??gra dagar sedan inte dyker upp n??r jag s??ker p?? taggen mincmalmo?,brisk-io,1,1,1,4,5,5,1,1,1,,
41261,alfred-gunnarsson,13676938445,salmiak,Tack Twitter. Jag ??r glad. Pixel lite mer skeptisk. http://yfrog.com/jnabfj #fb,brisk-io,2,3,2,3,3,2,3,4,2,,
41382,alfred-gunnarsson,12331712800,salmiak,Fick precis ett brev fr??n Nummerupplysningen.se - Vilket sk??mt! #bedragare #fb,brisk-io,2,4,3,2,4,2,2,3,2,,
42436,alfredo-artiles,4.31E+017,aartiles24,As?? trabajan los 'negros tuiteros' de las 'celebrities' http://t.co/wBAlE6KZUi,socialbro,2,2,1,2,2,1,2,2,1,,
43671,alfredo-artiles,2.8E+017,aartiles24,Why We???re Pivoting from Mobile-first to Web-first  http://t.co/b0TgchDV,socialbro,6,4,5,4,4,4,5,7,5,,
43944,alfredo-artiles,2.44E+017,aartiles24,"After Long Startup Journey, Seesmic Is Bought By Social Media Management Service Hootsuite [Confirmed] http://t.co/dHX2uKns",socialbro,9,8,8,8,7,7,8,9,7,,
44105,alfredo-artiles,2.29E+017,aartiles24,"Ha sido anunciar el release y petar Twitter, ya van 2 veces que nos pasa",socialbro,3,6,5,6,3,5,8,7,5,,
44107,alfredo-artiles,2.29E+017,aartiles24,SocialBro Heads to the Cloud to Run from Any Browser - The Next Web http://t.co/jGrF6hlH,socialbro,2,1,1,5,6,5,3,4,4,,
46175,alon-goren,2.11E+017,alonymous,Why go white label with your crowdfunding platform? http://t.co/4wDlLMWo,invested-in,2,4,3,4,4,4,5,4,3,,
47427,amit-jardosh,4.64E+016,amitjardosh,Am I willing to rent my car out to strangers for &lt,$5/hr? #relayrides Can't believe some have their Porsches listed. Let the joyrides begin.,ubersense,2,5,4,3,4,4,2,3,4,
50028,andra-tori,2.49E+017,andraz,Dual-Track Scrum http://t.co/vNWQaW7V,zemanta,2,3,5,8,8,8,6,4,5,,
51211,andrew-cornett,4.72E+017,amotion,"man, botch was so good + ahead of their time http://t.co/ocw5Z1HJpx",jukely,8,7,6,6,5,5,2,3,4,,
51432,andrew-cornett,4.56E+017,amotion,when do those mailbox desktop beta invites start rolling out? really wish i had a countdown to watch,jukely,2,4,4,4,4,4,3,5,4,,
52796,andrew-cornett,3.12E+017,amotion,"The hangtime app is a good idea but the FB events are mostly spam sent to friends that never responded, I???m not getting anything but junk :(",jukely,6,8,5,7,8,7,2,4,5,,
58128,andrew-montalenti,4.76E+017,amontalenti,"OH: ""There's never a shortage of bad ideas.""",parsely,3,2,5,6,6,5,6,4,5,,
58522,andrew-montalenti,4.34E+017,amontalenti,"The ""Personal Franchise Model of Journalism"". Individuals run their own media ""companies"": http://t.co/MrybAbOq03 (yes, yes, aka blogging)",parsely,2,3,4,3,6,4,3,6,4,,
59005,andrew-montalenti,3.85E+017,amontalenti,"""That's terrible news for restaurant owners, but great news for consumers, who enjoy more options &amp; lower prices..."" http://t.co/g7fTTKNeLU",parsely,7,7,5,6,4,4,4,3,3,,
59129,andrew-montalenti,3.74E+017,amontalenti,"Though I dig Twitter's new ""in-context replies"" thing, *this* just seems wrong. In my timeline, my tweet is duped! http://t.co/p0RAc2JBW4",parsely,4,5,4,6,6,4,5,5,4,,
60202,andrew-montalenti,5.39E+017,amontalenti,"""A programming language is low level when its programs require attention to the irrelevant.""

-Epigrams in Programming",parsely,4,4,3,5,5,4,2,3,3,,
62552,andy-mroczkowski,1.93E+017,amrox,I DO know the person who threw the tennis ball in #30. So I got that going for me. http://t.co/1Yb7OeAv,mindsnacks,5,6,6,3,2,3,6,5,5,,
62806,andy-mroczkowski,1.75E+017,amrox,Conclusion from tonight's research is that the tar file format is ripe for disruption.,mindsnacks,8,7,6,6,7,6,6,5,6,,
63493,andy-mroczkowski,1.31E+017,amrox,Middle eastern script kiddies strike again. http://t.co/n3uo9rab,mindsnacks,5,7,6,8,9,6,7,6,6,,
65169,angus-woodman,3.64E+017,angusw,This weekend's houseguests gave me a present ??? alcoholism! http://t.co/KGrIC6U6bE,ooomf-2,3,2,6,3,7,4,3,8,4,,
66298,angus-woodman,2.08E+017,angusw,There are 14.5 million pixels in my apartment. AND I AM THEIR MASTER!,ooomf-2,5,4,5,7,8,5,6,8,5,,
66447,angus-woodman,1.98E+017,angusw,"Theory: a coconut-based milk replacement would be amazing on Cocoa Puffs, Count Chocula or any other chocolate cereal.",ooomf-2,2,1,3,5,4,3,3,3,3,,
68749,anil-chawla,2.64E+017,anilchawla,always exciting when my flashlight iphone app gets an update!!,archivesocial,6,5,6,8,6,5,2,4,4,,
69175,anil-chawla,1.54E+017,anilchawla,"1st day ""back to work"" and already broke my resolution by working 13hrs #oops",archivesocial,6,7,5,7,7,5,3,4,4,,
69423,anil-chawla,1.19E+017,anilchawla,cut the price on my 2010 MacBook Air to $1075. Great price for 10mo old incredible laptop. 13.3 upgraded to 4GB RAM - msg me if interested!,archivesocial,2,2,2,6,7,6,7,8,7,,
69545,anil-chawla,1.07E+017,anilchawla,My quick blog post in honor of Steve Jobs: This is how you change the world http://t.co/tMNJ9ah,archivesocial,2,4,3,7,8,6,5,5,5,,
69777,anil-chawla,7.89E+016,anilchawla,perfect for a blazing hot day like today: *fresh* strawberry margarita (easy recipe) http://bit.ly/ldPBgb,archivesocial,3,4,5,8,9,8,7,6,5,,
71247,anji-ismail,3.09E+017,anjismail,J???ai publi?? une nouvelle photo sur Facebook http://t.co/6Ewara5eFn,doz,6,8,6,6,8,7,4,4,2,,
73257,anna-palmer-4,3.69E+017,FashionProjct,???Shoes transform your body language &amp, attitude. They lift you physically &amp, emotionally.??? C. #Louboutin Shop Heels: http://t.co/6LI05LlpC2,fashion-project,7,6,6,8,7,7,8,9,7
75993,anthony-cintron,8586976639,supdun,All that iPad hoo-ha welcomes iPadify. It's sooo funny! http://bit.ly/dmqf2O #amazing #excellent #beautiful #lol,take-the-interview,3,2,3,6,5,3,4,2,3,,
76454,anthony-cintron,2873666260,supdun,"Western Digital releases 1TB laptop drive, holla! http://is.gd/1P8fR",take-the-interview,3,1,3,7,7,6,1,1,3,,
76463,anthony-cintron,2731890472,supdun,Better late then never. The real story behind the Kindle kerfuffle. http://is.gd/1EKY9,take-the-interview,3,5,7,1,6,6,5,3,5,,
76734,anthony-cintron,1352431581,supdun,Dished out $600 bones for the latest Adobe Flash CS4. It feels good purchasing software.,take-the-interview,3,1,2,7,8,5,6,4,5,,
76763,anthony-cintron,1230757273,supdun,wife bought me a dope helmet from a Danish design company http://www.yakkay.com/,take-the-interview,3,3,3,6,8,6,5,6,5,,
76847,anthony-cintron,1139843818,supdun,Thank goodness for Time Machine,take-the-interview,2,3,3,5,3,4,6,5,4,,
77277,anthony-cintron,324251162,supdun,I'm done coding for the night.,take-the-interview,3,5,2,2,2,2,3,3,2,,
79382,anthony-nicalo,15427586234,TonyNicalo,Watching Chefs Move to Schools launch live http://ht.ly/1UaB3,donde,3,3,5,6,7,5,5,5,5,,
83359,arian-radmand,4.29E+017,aradmand,"Don't mess with me, bro. I'm #hacking  http://t.co/SuCsSj8FHC  #accessdenied #timesink",coachup-inc,2,5,7,7,4,5,7,4,5,,
84301,arnav-anand,1.74E+017,arnavanand,It's Time to Bring Manufacturing Back to the U.S. - David Simchi-Levi - Harvard Business Review http://t.co/EJ6Tmkl7,resolutiontube,2,3,3,6,6,5,5,4,5,,
85230,arram-sabeti,2E+017,arram,http://t.co/feTCKAEX,zerocater,2,2,4,2,3,4,3,5,4,,
87021,arthur-lozinski,1.59E+017,ArthurLozinski,"Make a list, check it off. #productivity",oomnitza,1,1,2,5,7,4,4,4,5,,
87467,arthur-madrid,2.66E+017,arthurmadrid,"""It all comes down to one thing: you. It is what of my hands now. it's in yours"" #voteobama http://t.co/rYidwSNd",pixowl,5,3,6,4,6,5,4,3,5,,
88364,arthur-madrid,981491907,arthurmadrid,at gal costa concert.,pixowl,5,5,5,3,5,6,6,7,5,,
89141,ash-rust,4.42E+017,AshRust,Landed in Austin for #SXSW. I don't recommend wearing skinny jeans on flights.,sendhub,2,2,4,2,3,4,3,3,4,,
90504,ash-rust,6.37E+016,AshRust,Finally getting on the plane to Nashville.,sendhub,6,7,6,4,3,5,7,7,5,,
91839,ashwin-pushpala,2.45E+017,ashwinpushpala,umami burger with lil' push http://t.co/u5fIuUwv,sano-intelligence,2,5,3,4,2,3,6,8,7,,
92009,ashwin-pushpala,29052613181,ashwinpushpala,first world series shutout for the giants since 1954! matt cain is the man! 2-0! #sfgiants,sano-intelligence,2,4,4,6,5,4,3,1,4,,
93378,austin-evarts,1.88E+017,AustinEvarts,Obama is expressing his support to bring back SOPA! Tell him no here: #OBAMArevivingSOPA http://t.co/VZ4OgF0X,gochime,3,1,4,4,2,5,5,5,4,,
94306,austin-evarts,3.6E+016,AustinEvarts,"I'm Reading: Waking Education: Dialogue from Waking Life:

I like that. It???s like there???s this whole telepathic t... http://bit.ly/dVO8s9",gochime,6,6,6,7,6,5,4,4,4,,
94315,austin-evarts,3.44E+016,AustinEvarts,I'm Reading: QUOTE: One of the things about design that makes???: One of the things about design that makes it suc... http://bit.ly/f4pNvy,gochime,1,1,2,2,3,4,1,3,3,,
94352,austin-evarts,2.93E+016,AustinEvarts,???Discovr??? iPad App Shows Interactive Maps of Music [VIDEO]: Discovr is a new music discovery app for iPad that s... http://bit.ly/eXEST1,gochime,5,5,6,6,6,6,7,5,5,,
94360,austin-evarts,2.78E+016,AustinEvarts,"Google Announces Doodle Contest for Kids: 



Get the colored pencils and construction paper ready. Kids in t... http://on.mash.to/eDzv7P",gochime,7,5,6,9,6,7,9,9,7,,
94420,austin-evarts,1.29E+016,AustinEvarts,Back in Paradise http://instagr.am/p/gZ1o/,gochime,6,7,8,9,7,8,9,4,7,,
95086,avi-millman,5.48E+017,AviMillman,Morning shower http://t.co/lJkWCVCSKj,stray-boots,2,4,6,4,5,5,8,8,7,,
95775,baha-abu-nojaim,8.31E+016,Baha_AbuNojaim,Flash webcam to Unity (WEB) now supports networking and streaming check it out http://bit.ly/hVqhQu #unity3d #assetstore,mxd3d,3,3,4,5,3,5,6,7,5,,
95835,baha-abu-nojaim,27016218058,Baha_AbuNojaim,I uploaded a YouTube video -- MS Jordan Offices by Mixed Dimensions http://youtu.be/klsc3UQ2OtQ?a,mxd3d,2,2,2,8,8,8,7,6,7,,
97091,baldwin-cunningham,1.8E+017,Baldwin,Shit just got real. (with Bear) [pic] ??? http://t.co/YFRE7YRv,sponsorfied,3,1,2,4,4,6,4,1,6,,
98455,baldwin-cunningham,3.55E+016,Baldwin,Photo:  http://tumblr.com/xn31h0w2vm,sponsorfied,2,5,2,2,6,3,2,4,2,,
98819,bart-ciak,5.49E+017,BartCiak,"Auvik Networks is looking for: Web Designer and Developer

http://t.co/EJwjaHLWYK #job",gospotcheck,9,9,9,6,5,3,4,1,3,,
98831,ben-rubin,5.24E+017,benrbn,When you nail a great product spec. http://t.co/f7WzYBGCK6,yevvo,2,4,2,7,6,5,6,5,4,,
99486,ben-rubin-3,5.33E+017,bsrubin,Help us out on product hunt - Change: Courses led by experts to help you reach lifestyle goals. http://t.co/ZTipTiR47C,change-collective,7,5,3,6,4,3,4,2,3,,
100197,ben-rubin-3,1E+017,bsrubin,You must be paralyzed with fear in order to grow http://t.co/OvFzfot,change-collective,2,5,2,4,2,3,4,6,4,,
100299,ben-rubin-3,5.93E+016,bsrubin,Optimists have better lives - here is how to become one:  http://bit.ly/h8MH4H,change-collective,3,5,6,4,5,5,8,5,5,,
100311,ben-rubin-3,5E+016,bsrubin,Totally onboard with http://www.drgreene.com/whiteout - no more white rice for babies #health2con,change-collective,6,4,5,8,6,5,7,8,5,,
100599,ben-rubin-3,15331283683,bsrubin,Google Health may be dead - will the concept of a Personal Health Record die as well?  http://bit.ly/dsoKYn,change-collective,2,8,4,8,7,8,4,2,4,,
101959,ben-wyrosdick,3812377301,benwyrosdick,google changed the logo when I searched for ASCII art http://bit.ly/sAAFW,mongohq,2,2,2,7,7,8,5,5,5,,
102659,ben-wyrosdick,990833704,benwyrosdick,an ironing board makes a good stand-up desk,mongohq,4,6,5,5,2,5,6,6,5,,
103638,ben-wyrosdick,544317352,benwyrosdick,taking down Christmas stuff .... I got the tree down and into the attic by myself :),mongohq,7,8,6,5,3,5,1,4,4,,
104650,benjamin-shyong,3.31E+017,bshyong,"Habit is a cable; we weave a thread each day, and at last we cannot break it.",meddik,3,4,7,6,4,6,5,3,5,,
104699,benjamin-shyong,3.24E+017,bshyong,Urgency and Want (Forecasting) http://t.co/Mlg8ezLFsy,meddik,4,1,3,3,5,4,4,5,4,,
106292,benjamin-shyong,1.46E+017,bshyong,"How to drill a square hole



http://t.co/GnGn03cg",meddik,3,7,5,7,9,8,5,6,5,,
106710,benjamin-shyong,7.39E+016,bshyong,"YouTube Turns 6 Years Old, Daily Views Shoot Up To 3 Billion (Yes, 3 Billion. Daily??? http://goo.gl/fb/9SUme",meddik,3,1,4,2,1,4,1,1,3,,
108147,benjamin-young,1.91E+017,obenyoung,Nextpeer Pledges To Make Any Mobile Game As Social As OMGPOP???s ???Draw Something??? http://t.co/8uSZXDDz - Thoughts?,nexercise,6,2,5,5,3,5,6,3,5,,
108230,benjamin-young,1.86E+017,obenyoung,??? likes http://t.co/Y6Md4GrJ,nexercise,1,1,3,1,2,3,2,1,3,,
108451,benjamin-young,1.5E+017,obenyoung,Is the only thing you're exercising this week- an option to leave work early? - http://t.co/CiaVzlol,nexercise,3,4,6,2,2,5,5,7,4,,
108712,benjamin-young,1.12E+017,obenyoung,Anybody had any experience with Wildfire for internet or mobile plays? http://t.co/hmcrgt0,nexercise,2,1,4,4,5,3,6,3,4,,
109559,benjamin-young,4.79E+016,obenyoung,I have a webinar tomorrow (technically today) with 25+ perspective #Nexercise vendors and I can't sleep. Ugh.,nexercise,2,3,4,2,5,4,2,2,4,,
114740,blaine-schanfeldt,1.29E+017,blaines,Whatsup,cloudbot,2,4,4,5,7,4,2,3,4,,
115069,blaine-schanfeldt,6426459578,blaines,http://br.st #macgiveaway I need a new MacBook!,cloudbot,4,8,6,4,3,5,4,2,5,,
115286,bob-gilbreath,4.79E+017,mktgwithmeaning,"SMG, Twitter Find (Surprise) Twitter Is Impacting TV http://t.co/uwVfAHepA1",pingage,7,5,6,4,2,5,1,3,4,,
117075,bob-gilbreath,1.39E+017,mktgwithmeaning,"""No memory of what the ad showed? Perhaps the audience blinked!"" from http://t.co/DZm79cye",pingage,8,9,9,5,6,5,3,4,6,,
117555,bob-gilbreath,5.35E+016,mktgwithmeaning,Moms with smartphones spend 50% more web time on mobile than PC http://bit.ly/eKX1zp,pingage,2,3,3,5,3,4,6,4,4,,
118551,bong-koh,3.7E+017,bong,"I'm at The Waffle Shop (State College, PA) http://t.co/8frXABNM8V",lifecrowd,3,5,4,7,5,3,6,5,4,,
119998,bong-koh,3388184772,bong,taking my mom to the phillies game tonight.  lmk if you are going.,lifecrowd,6,6,6,3,5,6,7,5,7,,
121599,bora-celik,4.01E+017,xBora,"??? Photo app.

??? Photo app for front and back shots.

??? Photo app for front shots only. http://t.co/tF6ep65BFP

??? Photo app for landscape only.",jukely,2,4,1,1,2,1,1,3,1,,
123724,boris-jabes,919416907,borisjabes,loving the sun in downtown (westlake) workspace,meldium,3,5,6,7,8,5,5,7,6,,
125069,botjan-peti,1.68E+017,igzebedze,New post: : What is Google Panda - Awesome Infographic http://t.co/DziDmJdu,zemanta,8,9,7,9,8,8,7,6,8,,
125963,botjan-peti,937311079,igzebedze,"whoa, i'm a chicken: http://www.dopplr.com/traveller/igzebedze/public",zemanta,9,9,6,2,1,4,8,6,5,,
126154,botjan-peti,861994817,igzebedze,Kaymac constructions... :),zemanta,1,3,4,4,6,4,3,2,4,,
127189,brad-mcnamara,1.83E+017,CarFreeBrad,Welcome to the iPhone Era CarFreeBrad!  I need Apps! http://t.co/XCd1wxDk,freight-farms,4,2,2,5,1,2,5,3,2,,
127364,brad-mcnamara,1.56E+017,CarFreeBrad,"""The Social Life of Small Urban Spaces""   A short movie and forum, with speakers: Dr. Walter Willett http://t.co/NqAUfdz9",freight-farms,6,8,4,6,7,5,7,8,7,,
128258,brad-mcnamara,7.44E+016,CarFreeBrad,"Nothing to do with CarFree or anything related! Bruins Win, It's Memorial Day Weekend and no one will read this... http://fb.me/13u9g9dyw",freight-farms,3,6,4,6,8,4,2,4,4,,
128575,brad-mcnamara,1.62E+016,CarFreeBrad,NBC. 2010 Ford Ironman Championship right now!,freight-farms,7,6,5,7,4,5,3,2,4,,
129565,bradley-buda,2.99E+017,bradleybuda,I can???t believe I don???t have graphviz installed. I apologize for being a terrible developer.,meldium,4,4,4,6,4,3,8,8,8,,
130595,bradley-buda,1.49E+017,bradleybuda,I apologize for what I said about Bieber being the new Timberlake. I was clearly way off: http://t.co/JgwZOwNW #fb,meldium,1,1,1,8,6,5,4,3,5,,
131851,brandon-arbini,7144093456,brandonarbini,"Boy, we are in the south alright! Just had a 15 minute conversation with a stranger at the Waffle House. #fb",zencoder,8,6,6,7,9,6,6,6,6,,
132354,breeanna-bergman,2.94E+017,BreezyBerg,Definitely the largest piece of becon I've ever eaten! #yum http://t.co/7R97WtPi,repp,5,7,6,8,4,6,8,9,7,,
132659,breeanna-bergman,2032000793,BreezyBerg,wondering what animal I would want to be... hmmmmmmm,repp,1,1,3,7,5,4,8,9,9,,
133613,brendan-lim,2.73E+017,ok,Do everything. Then hire. http://t.co/W6ASStgX,kicksend,5,5,6,6,7,5,4,2,5,,
136480,brent-daily,1630019264,brentdaily,unless you just rolled out of a holiday inn why would you choose to read the USA Today?,roundpegg,3,6,5,3,5,4,1,1,3,,
136863,brent-daily,827813539,brentdaily,argh! forgot about yoga.  it's been too many months i need to strectch my muscles.,roundpegg,3,2,4,5,2,5,4,2,4,,
138225,brent-grinna,3.81E+017,brentgrinna,"""Timehop for Investor Decks"" http://t.co/GsgBY7iJ2j",evertrue,2,3,6,7,7,5,7,6,5,,
