,Owner,id,screenName,Text,company,i1,i2,i3,p1,p2,p3,t1,t2,t3,,
444342,jim-payne,2.53E+016,jimpayne,Great idea for Accel to open a real presence there... lots of talented folks who can build great companies,mopub,1,2,3,6,9,6,6,8,6,,
444633,jinal-jhaveri,1.26E+016,jinal,edReformer: Union Square Investment Puts Edmodo in High Gear http://bit.ly/i0BCLh,schoolmint,3,5,4,5,7,5,4,6,4,,
444690,jinal-jhaveri,1622028621,jinal,is still lazing in bed,schoolmint,2,4,3,4,2,3,2,2,3,,
444723,jinhee-ahn-kim,4.87E+017,ijinhee,Stopped and smelled the roses on my morning jog around the park. Yes those are rows and rows of roses.??? http://t.co/yplivo6jfv,snapette,6,8,7,8,7,6,7,6,6,,
445367,joe-ariel,4.45E+017,JoeAriel,"It's freakin' #PiDay!!! So getcha PIE on for $3.14:   



https://t.co/eXHlfGmCdz ???",goldbely,6,7,4,6,3,4,6,2,4,,
445853,joe-ariel,1.58E+017,JoeAriel,how are the grizzlies are making the knicks look like the washington generals?,goldbely,2,3,4,3,5,3,6,7,5,,
446247,joe-gebbia,3.89E+017,jgebbia,#Legalizesharing in NY and protect Airbnb hosts. Fix the slumlord law: http://t.co/7tg0piXfDN,airbnb,4,6,5,3,5,4,3,5,4,,
446346,joe-gebbia,3.6E+017,jgebbia,Anatomy of a RISD party http://t.co/nLCWnXPoHR,airbnb,9,7,6,8,6,6,7,6,5,,
446460,joe-gebbia,3.12E+017,jgebbia,Late night ahead. Best place to get coffee in SOMA at this hour? #gametime,airbnb,2,5,3,5,6,4,3,4,5,,
446565,joe-gebbia,2.92E+017,jgebbia,Eames House: Ray &amp, Charles Eames Need Your Help http://t.co/GFPzY820,airbnb,4,6,3,3,3,3,2,3,3,
447840,joe-gebbia,6.96E+016,jgebbia,"hey iPhone users, what's the trick to make an international call from an iPhone",airbnb,4,5,6,7,6,7,7,7,7,,
448134,joe-gebbia,3.65E+016,jgebbia,Three awesome project dashboards http://post.ly/1c2Kn,airbnb,7,9,8,8,8,8,6,7,5,,
449965,joel-gillman,1.15E+017,jgillman,Sitting or standing desk? I'm on board with Cornell: http://t.co/Y3Hjmo8H,goldbely,3,3,3,6,4,5,4,6,4,,
450501,joel-gillman,6288600697,jgillman,Check out my latest game of Icon Garden! http://twitpic.com/rwj80 (http://rampchamp.com/),goldbely,4,2,3,8,5,6,3,1,2,,
452136,joey-alfano,1.99E+017,joeyalfano,"I'm at Washington Park Grille (Denver, CO) w/ 3 others http://t.co/s9ZXel8M",gospotcheck,2,6,4,7,9,8,5,6,4,,
453058,john-a-de-goes,5.25E+017,jdegoes,Purescript lenses for record fields can be polymorphic in the type of record: one lens works on *all* records that have the named field.,reportgrid,3,4,3,2,5,3,2,5,3,,
457229,john-collison,3.83E+017,collision,Our signature strikes target anything associated with or matching the profile of a bowling pin.,stripe,9,9,8,9,7,6,8,5,7,,
457619,john-collison,3.45E+017,collision,"On June 11, 2013, we mailed you a notice that we have approved this I140 IMMIGRANT PETITION FOR ALIEN WORKER.",stripe,6,3,4,8,5,4,6,3,4,,
457657,john-collison,3.44E+017,collision,More smug California references in Apple marketing. I approve.,stripe,4,1,2,5,3,2,5,3,2,,
457669,john-collison,3.41E+017,collision,"The snarky use of ""presented without comment"" has made it difficult to genuinely present things without comment.",stripe,5,7,6,7,4,5,4,5,5,,
457885,john-collison,3.12E+017,collision,Seems like a wasted opportunity that Google refer to this process as spring cleaning rather than The Reaping.,stripe,3,5,6,6,6,5,6,2,4,,
458436,john-collison,2.36E+017,collision,"I want a trance album that mixes in great ATC snippets.



""Armin Van Buuren vs US 1549 birdstrike"", anyone?",stripe,3,5,4,7,6,4,6,5,4,,
458555,john-collison,5.42E+017,collision,"??????



""3-day rainfall of 2-4 inches.""

""still uncertainty whether winds will be merely strong or perhaps damaging.""



http://t.co/0vqD61VRFr",stripe,2,3,1,2,3,1,2,3,1,,
458735,john-dulay,1491404432,john_irving,They finally come out with a dragon ball movie with real people - http://www.imdb.com/title/tt1098327/,reesio,2,1,4,1,2,4,8,7,6,,
459013,john-fan,1.51E+017,_cardinalblue,"""The Android community is traveling along a path that the old Windows Mobile platform followed a few years ago. It... http://t.co/fNACUXRt",cardinal-blue-software,5,4,6,5,7,5,6,4,5,,
460034,john-laramie,4.61E+017,JLNY,good lord crunchbase is sending a lot of emails now,adstruc,5,7,4,3,5,3,4,5,4,,
460391,john-laramie,4.31E+017,JLNY,"""John, people are looking at your LinkedIn profile"" is the creepiest notification ever...",adstruc,2,3,4,2,4,5,1,3,3,,
461064,john-laramie,3.46E+017,JLNY,#OOH is a network of locally connected assets that is massively underutilized. Connect them with data. Improve access. Tell better stories.,adstruc,2,4,5,3,6,4,6,7,5,,
462302,john-mertens,2.68E+016,mertonium,Me & San Francisco http://twitpic.com/3qqv1c,electnext,2,3,4,6,6,5,5,5,6,,
462314,john-mertens,2.57E+016,mertonium,Amazon EC2 Enables Cheap Brute-Force Attacks: http://bit.ly/hTrZd7,electnext,3,4,5,6,6,5,5,3,5,,
462571,john-mertens,10817987583,mertonium,"Flat Ben visits his 31st country in 5 years.  Welcome to the fold, Malta: http://flatben.org/component/geophoto/?cid=21",electnext,4,6,6,4,2,5,5,3,5,,
462624,john-mertens,9524389431,mertonium,The waves of nausea need to stop.  Now.  I've got a half-marathon this weekend.,electnext,8,6,6,6,5,5,7,5,5,,
462659,john-mertens,8655941155,mertonium,Mertonium: : The Underground http://bit.ly/bSFMWp #aphotoaday #glasgow,electnext,3,2,4,8,9,6,6,5,5,,
463322,john-phan,4.49E+017,jxtphan,Drones are taking over the world.,qwiqq,8,7,6,3,2,5,3,4,3,,
463413,john-phan,4.32E+017,jxtphan,CVS to phase out cigarettes and tobacco products by Oct. 1.,qwiqq,2,1,3,7,7,6,6,7,6,,
465906,john-s-kim,4.27E+016,dotty,"??????! ?????? ??????????????? ????????? ?????? ????????? ???????????? ???????????? ????????? ?????????! ???????????? ???, ???????????? ???????????? ???????????? ????????? ?????? ??? ??????. (????????? ?????? ???????????? ?????? ???????????? ???????????? -_-) ???????????? stack????????? ??? ???????????? ?????? ?????????.",smile-family,1,1,1,1,3,1,1,2,1,,
466793,john-zdanowski,4.53E+017,johnzdanowski,After two I'm done.... after seven I'm unstoppable,trustegg,6,5,7,7,7,6,6,5,6,,
467075,john-zdanowski,8.41E+016,johnzdanowski,"You Say Potato, Scale Says Uh-Oh http://on.wsj.com/iu2X2C

I love being 35 lbs lighter than was last year.  Search for VLCD and lose it too.",trustegg,7,4,5,8,7,5,2,4,4,,
467258,johnny-lee,4.14E+017,Spotsetter,From our team holiday event last night: taco crawl in the Mission! http://t.co/ilWRc86be6,spotsetter,5,7,6,3,5,6,5,6,6,,
468172,jon-dahl,4.68E+016,jondahl,"Lean Startup SXSW Afterparty (Cedar Door), and maybe the icanhascheezeburger party if I can find a way to get in. #freestuff",zencoder,6,6,5,5,4,4,9,7,6,,
468397,jon-dahl,6127059692,jondahl,"Found a half-price wine sale today. Good wine, 50% off retail. Bought 33 bottles. No more wine shopping for me for at least a year. ;)",zencoder,4,2,5,8,8,7,8,6,7,,
468735,jon-dahl,925289085,jondahl,"named_scope is great. But what happens when 5 are nested, including multiple subselects?",zencoder,7,7,8,2,3,4,3,4,3,,
469357,jon-nordmark,1.34E+017,Jon_Nordmark,"U.S. wealth gap 'tween young & old is widest ever; under 35, you're likely struggling : http://t.co/KrSuzSA5",travelfli,2,4,3,8,6,8,4,2,3,,
470959,jon-wheatley,3.06E+017,jon,San Francisco seen from Oakland. http://t.co/Pgh9XEjC9n,dailybooth,5,7,6,6,7,5,6,5,5,,
472136,jon-wheatley,1.12E+017,jon,Messing around with ifttt.com http://t.co/PV6KY2o,dailybooth,8,6,6,8,7,5,7,6,5,,
472569,jon-wheatley,7.68E+016,jon,Having an office on the 5th floor isn't fun. http://dailybooth.com/u/9qbch,dailybooth,9,7,6,9,7,5,3,5,4,,
472776,jon-wheatley,5.79E+016,jon,We have a new addition to the office today.  http://t.co/qUQ3J1T,dailybooth,9,8,8,7,8,7,8,6,7,,
472946,jon-wheatley,4.45E+016,jon,Yay aliens. http://yhoo.it/h0x9Xw,dailybooth,9,8,6,6,7,5,2,3,4,,
473749,jonah-stein,4.52E+017,Jonahstein,"If you a SaaS company OR want a great content marketing example, must read http://t.co/0t8gKXlzkG?",codeguard,5,6,6,9,9,8,6,4,6,,
473811,jonah-stein,4.49E+017,Jonahstein,Anti regulation hypocrisy on display as states try to regulate sharing economy &amp, disruptive business models. http://t.co/isvkIKMah6,codeguard,5,6,4,3,6,4,3,3,4,
474947,jonah-stein,3.38E+017,Jonahstein,"Where is our outrage: sentence first time drug offender &gt; for rape, child molestation, bank robbery or manslaughter. http://t.co/ognzfap1Fh",codeguard,7,8,6,4,6,5,2,1,4,,
475057,jonah-stein,3.3E+017,Jonahstein,"Challenges in measuring mobile:  1. Proliferations of devices and platforms #BESTcon, need to learn how to collect data",codeguard,2,2,4,7,6,5,6,5,4,,
477047,jonathan-hochman,2626272316,Jehochman,My Facebook profile page has really lame ads.  Am I boring?,codeguard,2,3,4,2,5,5,7,4,5,,
478252,jonathan-lacoste,3.11E+017,lacostejonathan,"Shaq is actually a big tech geek, and he might be interested in investing in your startup http://t.co/6uO1D4TI0A",jebbit,6,9,7,9,5,6,6,4,6,,
479222,jonathan-lacoste,2.05E+017,lacostejonathan,Florida State student died in Beijing today...this isn't helping my mom's fears about my trip to Beijing next month http://t.co/LPMUigmG,jebbit,4,4,4,6,4,3,6,5,4,,
484305,jonathan-wegener,4.46E+017,jwegener,"So if you get a new android phone, you have to reinstall and re setup all your apps? Seems like something out of 1999",timehop,2,3,3,8,7,6,7,9,8,,
485226,jonty-kelt,4397332229,jontykelt,http://bit.ly/Dfgoy,onswipe,1,3,4,2,2,4,5,6,4,,
485864,jose-li,3.65E+017,71lbs,"Together, 3dcart and 71lbs Save Online Store Owners Time and Money: http://t.co/AiHeTxhwEA",71lbs,6,5,3,6,4,3,7,7,6,,
486069,josh-buckley,4.54E+017,joshbuckley,"""The conundrum is how to become mature and become reliable while at the same time preserving your childlike wonder""",minomonsters,2,3,3,3,5,4,4,4,4,,
486195,josh-buckley,3.71E+017,joshbuckley,I received this invite to a white party this morning http://t.co/VYfiAuGwLC,minomonsters,6,5,4,8,9,7,6,5,4,,
488926,josh-hix,8.14E+016,joshhix,"Reminded today of how motivating startup rejection can be. Never gets easier, but a lot of valuable feedback buried in there???",plated,4,4,4,6,3,5,5,3,6,,
490064,joshua-bloom,3.75E+017,profjsb,"Last decade, everyone wanted to be a DJ. Now, everyone wants to run a bootcamp.",wise-io,6,6,6,3,6,5,1,1,3,,
491083,joshua-reeves,1.22E+017,joshuareeves,"Absolutely stunning landscapes...a reminder of the broader world/ecosystem we live in, outside of our day to day lives. http://t.co/CHQ4PUus",zenpayroll,9,9,8,1,3,4,3,4,3,,
491139,joshua-reeves,9.34E+016,joshuareeves,"Good advice. ""How to Raise Investment Capital - According to VC Jeff Clavier"" - http://t.co/FIMAxiR",zenpayroll,6,7,3,8,6,4,9,9,8,,
491997,jude-gomila,5.25E+017,judegomila,$542M -&gt, Magic Leap http://t.co/cO3802PjO9,heyzap,3,2,6,3,1,4,3,2,4,
492980,jude-gomila,4.28E+017,judegomila,Beyond the carnot limit - http://t.co/5GLhDeAlzK,heyzap,2,3,2,3,5,3,3,3,3,,
493685,jude-gomila,3.51E+017,judegomila,Great post from Nic - https://t.co/qjB6YONzGH,heyzap,2,3,4,6,6,5,6,3,4,,
494736,jude-gomila,1122015518,judegomila,heyzap has launched! http://tinyurl.com/72xuwy=,heyzap,2,4,5,7,8,5,8,6,5,,
496805,jude-ower,1.39E+017,playinthecloud,Shortlisted companies for Giving Fund! http://t.co/s6FoZsZI,playmob,3,4,6,7,5,6,6,8,5,,
498126,jules-coleman,3.44E+017,julescoleman,"I don't whether to feel joy or rage.



Just spent 12 hours debugging something that required a single line fix.",hassle,8,9,7,8,7,5,3,5,3,,
498311,jules-coleman,3.11E+017,julescoleman,"I don't care for the irony. Going for Gold was an afternoon TV masterpiece. Up there with Supermarket Sweep.

http://t.co/dEFZvFCnRq",hassle,2,3,4,5,2,3,8,5,4,,
499092,julie-haddon,2.53E+017,julietweets,Killing it on #SongPop tonight. What can I say? I'm a champ in 80s and musicals. #humblebrag,scribd,6,6,5,6,4,4,7,6,4,,
499597,julie-haddon,10476264661,julietweets,This panel ought to be interesting: http://my.sxsw.com/events/event/5082,scribd,7,8,6,7,7,5,6,4,5,,
501034,junpei-naito,3.91E+017,junpei_naito,????????????   ???????????????????????????????????????????????????????????????????????????????????????,whill,3,1,1,3,2,1,3,2,1,,
501288,junpei-naito,2.94E+017,junpei_naito,????????????????????????????????????????????????????????????????????????????????????????????????????????????,whill,2,3,1,3,2,1,2,3,1,,
502123,junpei-naito,1.87E+017,junpei_naito,??????????????????????????????????????????????????????????????????????????????????????????????????????????????????????????????????????????????????????????????????,whill,1,2,1,4,6,5,1,4,1,,
503975,justin-delay,3.74E+017,justindelay,Photo: My Mom http://t.co/834pYZmYM1,tempo,3,5,6,6,4,6,8,7,7,,
504136,justin-delay,3.24E+017,justindelay,So proud of this music: http://t.co/uUwDJIStx1,tempo,5,4,6,7,4,5,3,6,4,,
504443,justin-delay,2.44E+017,justindelay,My new sounds: first Korg iMS-20 Jam http://t.co/jSkS9KtG on #SoundCloud,tempo,5,6,3,3,2,3,5,4,3,,
506128,justin-delay,29128622949,justindelay,"Blog post: ""The Importance of Agility"" http://bit.ly/coKadI",tempo,3,6,6,2,5,4,2,1,4,,
508808,justin-kan,2.15E+017,justinkan,Those neon pink Nike Frees are like the running shoe equivalent of Laboutins.,twitch,2,2,2,6,4,5,7,5,6,,
511930,justin-massa,5.41E+017,justinmassa,Inbox invite secured - thanks!!,food-genius,5,7,6,5,3,5,7,9,8,,
515119,justin-wong-2,925117384,justinzwong,"contemplating, in deep thought.",battlefy,5,6,5,8,7,9,9,9,9,,
516240,keith-moore,4.01E+017,M00RE,RT 4 Trends that explain how #SocialMedia is finally helping savvy companies sell online http://t.co/8xa0gPaEZ8,coverhound,4,5,5,8,7,7,7,9,7,,
516241,keith-moore,4.01E+017,M00RE,Boston's Drop - What Advertisers like more than Engaged Users is their Location Information http://t.co/ROtJfQEIkM,coverhound,2,2,4,8,9,6,7,9,8,,
516335,keith-moore,3.9E+017,M00RE,World's Largest Job Outsourcing Marketplace http://t.co/8pFvMibIoe Files For $14.2M IPO.  http://t.co/IuxJeCP6AK,coverhound,2,5,4,8,5,7,9,7,8,,
517425,keith-moore,2.01E+017,M00RE,"Experian Agrees to Sell LowerMyBills, ClassesUSA, and Pricegrabber. http://t.co/a4Q2QblA",coverhound,6,7,7,8,9,7,7,6,8,,
517725,keith-moore,1.59E+017,M00RE,"""Change does not roll in on the wheels of inevitability, but comes through continuous struggle."" MLK quote",coverhound,3,5,6,2,4,5,3,5,4,,
517761,keith-moore,1.57E+017,M00RE,Apple???s Textbook Venture: What???s the Big Idea http://t.co/RDhLC7iu #education,coverhound,2,3,2,6,8,5,3,2,2,,
518213,kelly-eidson,4.78E+017,Keidson,Watching Silicon Valley and holy shit... This hits close to home.,moveline,3,4,3,8,9,7,2,1,4,,
520471,kelly-eidson,1.91E+017,Keidson,Under-slept and listening to Jose Gonzales. Laying on the couch at the office  and processing emails. Any bets on how long before I crash?,moveline,6,7,5,7,5,5,5,6,5,,
521566,kelsey-falter,4.08E+017,kfalter,Miley receiving 95.3% of her votes for #TIMEPOY from fansTweeting. Only 4.7% of her votes from http://t.co/Kj6joFtins http://t.co/q26HtU1sba,poptip,5,4,7,5,7,6,4,3,6,,
524497,kerry-schofield,4.05E+016,ciceroscobie,http://bit.ly/gUYc55 Binge drinkers with HIV have similar levels of depressive symptoms to ppl w/ alcoholism. #sciencespam #addiction,good-co,4,8,6,7,9,8,2,5,4,,
525012,kerry-schofield,1.9E+016,ciceroscobie,"Dad gave SO & me a folding table/firescreen, made c. 1920. He bought it in battered condition & restored it perfectly. Handmade gifts ftw!",good-co,6,5,6,7,6,5,6,8,4,,
525842,kerry-schofield,2074858357,ciceroscobie,"Cold and windy-wet today! I like this weather, it makes me want to write ghost stories :)",good-co,3,5,2,5,5,2,4,5,3,,
526906,kevin-lacker,25331059378,lacker,"Beer distributors are lobbying against marijuana legalization, but teachers support it. http://bit.ly/bv8Y0e",parse,1,4,2,5,7,4,2,3,5,,
530111,kim-taylor,2.8E+017,kimmytaylor,Crosby. WTF. #GBvsCHI,ranku,1,1,1,1,2,1,1,2,2,,
530373,kim-taylor,2.71E+017,kimmytaylor,It's okay everyone drink throwing didn't come from a place of anger it came from a place of sadness. #SiliconValley,ranku,3,2,5,6,5,5,5,3,5,,
533656,konstantinos-sakkas,900851565,kostis,"???????? ???????? ???????? ?? ????????????, ???????? ???? 1000 ???????????? ???? ?????????? 3 ???????? ?? ????????????",taxibeat,2,3,1,3,3,1,1,2,1,,
534108,konstantinos-sakkas,755509232,kostis,???? Concretes ?????? ?????????????? 12/03 ???????? ?????????????? ?? ?????? ???? documentary fest. ?????? ??????/??????. ???????????????????? ???????????????? ?????? http://go.sync.gr/p1E7EP,taxibeat,1,4,1,1,3,1,1,2,1,,
534241,konstantinos-sakkas,636437922,kostis,&gt,nikos streaming live ?????? ?? metablogging ???? qik,taxibeat,1,2,3,2,4,3,2,3,3,
535173,krista-paul,3.05E+017,kristapaul,Exclusive: Pinterest Completes $200 Million Funding at $2.5 Billion Valuation - AllThingsD http://t.co/7TZyTa1YuZ,travelfli,6,8,7,8,9,7,4,5,4,,
535774,krista-paul,2260380675,kristapaul,"Recession sees resurgence in frequent flyer program member engagement: http://tinyurl.com/ntvqev Finally, statistics to support our hunch!",travelfli,5,8,4,3,5,3,2,3,3,,
535812,krista-paul,1696553285,kristapaul,Southwest just found my bag!!!! Six hour window for delivery. That will teach me to bring wine home from the vineyards. Not worth it.,travelfli,4,3,5,3,4,5,6,4,5,,
537183,kristo-krmann,3.94E+017,kaarmann,Notes on the cost of making payments and debating financial inclusion with EU central banks. #blogged http://t.co/jVJnLMykVU,transferwise,2,4,2,7,7,8,3,5,4,,
538228,kuldeep-kapade,1.93E+017,KuldeepK,Into The Wild: Lost Conversations From Steve Jobs' Best Years | Fast Company http://t.co/tEH4bJN3,adsnative,3,6,5,3,6,4,2,4,4,,
538318,kuldeep-kapade,1.22E+017,KuldeepK,"Steve Jobs: Imitated, Never Duplicated - http://t.co/Y6II6luw",adsnative,5,7,7,6,8,6,7,6,7,,
538483,kuldeep-kapade,6836742899,KuldeepK,All the great managers seem to be flocking on EPL as Man City appoint Mancini manager and Mark Hughes sacked. Where are you Mourinho?,adsnative,6,6,6,6,3,5,4,2,5,,
539909,kulveer-taggar,2.46E+017,kul,"That moment when you frantically try to clear morning voice before an early call, but everyone knows you just woke up. #fb",tagstand,6,5,7,6,4,6,4,2,6,,
540133,kulveer-taggar,2.16E+017,kul,"I'm at Colombo Sports Centre (Camberwell, England) http://t.co/fhIECwPX",tagstand,2,3,4,7,7,5,8,9,7,,
541285,kulveer-taggar,7.94E+016,kul,Heyll yeah Canucks! Party time in Vancouver. Good times.,tagstand,3,4,3,8,6,7,6,9,8,,
541909,kunal-anand,5.31E+017,ka,Calling Google to get my free Nexus 5 replacement. Why one of the largest companies in Silicon Valley is making me use the phone is insane.,prevoty,6,8,7,8,7,8,7,9,8,,
542056,kunal-anand,5.14E+017,ka,"""JSONx is an IBM?? standard format to represent JSON as XML."" http://t.co/bMS46AbhHY - huh, wonder which org will introduce JSONy",prevoty,3,1,3,7,6,5,7,6,5,,
542796,kunal-anand,3.88E+017,ka,Who's going to AWS re:invent?,prevoty,7,7,6,8,6,5,6,4,5,,
543649,kunal-anand,2.62E+017,ka,No Cheese Till Brooklyn,prevoty,2,3,3,3,1,3,2,4,3,,
543716,kunal-anand,2.49E+017,ka,Surprised that pre-fab homes haven't caught on quicker. Blu looks promising. http://t.co/NPh7ZTuo,prevoty,7,8,6,1,5,5,6,3,5,,
544350,kunal-anand,1.97E+017,ka,ran a 5k at 6am - now off to eat a ginormous breakfast,prevoty,2,5,2,4,1,2,3,2,2,,
546793,kyle-wild,4.22E+017,dorkitude,You can topple a mountain of hope with a speck of unfortunate doubt.,keen-io,2,6,3,6,6,5,3,4,5,,
547075,kyle-wild,4.06E+017,dorkitude,"If I'm building a team, I'll take generalists who are addicted to learning over specialists who are addicted to thinking they already know.",keen-io,2,4,6,2,1,5,5,7,6,,
548986,laura-fitton,5.1E+017,Pistachio,"never forget those we lost on 9/11.



also, never forget dignity, hope, courage, and love for our fellow humans.",oneforty,4,5,6,8,9,7,1,4,2,,
549113,laura-fitton,5.03E+017,Pistachio,there I was. SO excited that for maybe the first time ever I had actually remembered to bring cloth??? [pic] ??? https://t.co/wV6Rqo1HDh,oneforty,6,6,6,9,4,5,5,3,5,,
549155,laura-fitton,5.01E+017,Pistachio,heading out for a ride. #otherpeoplesboats (at Corinthian Yacht Club) ??? https://t.co/OXZhTjkUQg,oneforty,3,4,6,7,3,5,5,6,6,,
551045,lauren-mcdevitt,2.97E+017,laurenmcdevitt,Trader Joe's honey tangerine juice is so damn good you'll never want regular orange juice again.,wantworthy,3,7,6,4,6,5,4,7,5,,
551382,laurent-maisonnave,5.16E+017,zelaurent,Blue Man Group Unboxing the iPhone 6: http://t.co/tMinBJpXni,seevibes,5,4,4,3,1,3,3,2,3,,
552949,laurent-maisonnave,2.53E+017,zelaurent,T??l?? sociale: Tout le monde en parle et Occupation double s'emparent du classement http://t.co/aG8X3tEO #tlmep #od9,seevibes,2,5,3,2,2,3,2,6,3,,
553971,laurent-maisonnave,1.37E+017,zelaurent,Have Sex With a Guy With a Mustache Day http://t.co/bXSITS8q #movember,seevibes,3,1,4,5,3,4,6,7,4,,
554344,leandro-armas,4.67E+017,leoarmas,Scheduling #everypostbeta 17.10,everypost,3,3,4,2,5,4,2,4,5,,
554562,leandro-armas,3.02E+017,leoarmas,"Test....



http://t.co/kXMFr1H",everypost,2,4,1,2,3,1,2,3,1,,
555348,lee-sherman,26687283324,lsherman,The Top 5 Customer Complaint Letters ??? And What You Can Learn From Them  http://bit.ly/9ThLEI,visual-ly,2,2,3,9,7,6,7,7,6,,
555349,lee-sherman,26671668192,lsherman,Mint Slideshow: Money Art | MintLife Blog | Personal Finance News & Advice http://www.mint.com/blog/trends/money-art-slideshow-10072010/,visual-ly,7,8,6,6,4,5,7,7,5,,
555453,lee-sherman,19520419696,lsherman,I'm shopping on Gilt Groupe. Join me! http://www.gilt.com/invite/lsherman0,visual-ly,5,4,4,7,7,6,4,6,4,,
555682,lee-sherman,13028033140,lsherman,"Interesting mobile moves today -- Apple buys Siri, HP buys Palm.",visual-ly,6,3,4,3,3,4,4,5,4,,
555788,lee-sherman,9067255416,lsherman,Headed to Macworld.,visual-ly,5,6,6,4,6,6,9,8,7,,
556125,lee-sherman,2555738668,lsherman,You Saw the Descent Into Credit Card Debt http://su.pr/2F8aWC ...now the good news - The Ascent to Credit Card Nirvana http://su.pr/2CgO5Z,visual-ly,2,5,4,3,5,4,3,4,4,,
556273,lee-sherman,1707089526,lsherman,Caltrain running  late today,visual-ly,3,5,6,5,4,5,7,8,5,,
557645,lee-sherman,812927066,lsherman,"I'm at Museum of Modern Art, New York, NY 10019, USA (New York, NY 10019, USA) - http://bkite.com/00bB9",visual-ly,2,3,6,7,8,7,7,6,7,,
557886,leslie-silverglide,4.77E+017,WeAreWello,5 Easy Stretches to Do Today and Everyday! https://t.co/qBnCpMbNHY,wello,4,5,5,8,7,6,6,5,5,,
557955,leslie-silverglide,4.42E+017,WeAreWello,"Apparently exercise also makes you happier and smarter! #getontheexercisetrain

http://t.co/NMyWbrcoAT",wello,3,4,6,7,8,7,9,9,9,,
559723,lindsey-goodchild,2.73E+017,LindsGoodchild,Why investors (and companies) care about sustainability #businesscase #managerisk #savemoney #stayinnovative http://t.co/xX9a18xW,greengage-mobile,4,5,3,8,6,4,9,9,8,,
560291,lindsey-goodchild,1.37E+017,LindsGoodchild,Hanging out at the Toronto Greenhouse Summit #gbss2011 representing ECO Canada and chatting about the new Env. Practitioner Certification,greengage-mobile,3,5,2,6,5,5,5,5,5,,
561042,lloyd-armbrust,2.73E+017,larmbrust,I don't close cabinet doors. Chance are better that I'll need them open more than I'll need them closed. #FutureThinking #ThingsMyWifeHates,onlocal,6,7,7,7,2,5,3,4,4,,
561557,lloyd-armbrust,4920000000000000,larmbrust,I love pop radio stations... Who wants to hear drinking songs at 8am?! #bottomsupbottomsup,onlocal,4,5,4,4,3,3,7,3,3,,
563507,lloyd-price,4.39E+017,lloydgprice,Quantas set to cut 5000 jobs in response to major losses http://t.co/HS1agdKApN???,zesty,6,7,7,2,4,5,3,4,2,,
563543,lloyd-price,4.38E+017,lloydgprice,"Why Content is King, but Distribution is Queen http://t.co/hGKn0ybiRk",zesty,2,4,5,4,3,5,6,7,5,,
563733,lloyd-price,4.32E+017,lloydgprice,Evernote Denies ???Secret??? Acquisition Rumor http://t.co/F1tiDQ15pA,zesty,3,1,2,6,4,4,5,4,4,,
564270,lloyd-price,4.04E+017,lloydgprice,Vodafone unveils mobile wallet service for Europe http://t.co/9sxV8y7PFI,zesty,4,3,5,4,6,5,6,4,5,,
564677,lloyd-price,3.86E+017,lloydgprice,"Do Etsy???s changes risk making it like eBay?  Sellers in an uproar, changes may be boon for rival startups http://t.co/38stTfYILB",zesty,1,3,2,5,6,4,6,5,5,,
564710,lloyd-price,3.85E+017,lloydgprice,Why investors should take another look at eCommerce http://t.co/Wd31oGIlVW,zesty,5,3,4,5,4,6,5,5,4,,
565004,lloyd-price,3.74E+017,lloydgprice,Tumblr Teams with Major Fashion Brands http://t.co/cK59kEeD7O,zesty,3,1,4,2,5,4,1,3,4,,
565061,lloyd-price,3.72E+017,lloydgprice,"Marc Andreessen, Pat Gelsinger in verbal VMworld brawl - Netscape legend and VMware CEO clash http://t.co/9UU6Mmuqlg",zesty,6,7,6,6,4,5,6,3,5,,
565599,luis-pablo-pardo,6.66E+016,LuisPabloPardo,Zuckerberg deja el alquiler http://bit.ly/mqY3LR,socialbro,2,5,6,7,6,5,7,6,5,,
565757,luis-pablo-pardo,6774205107,LuisPabloPardo,"""no tengo dinero, pero lo pagar?? cuando me den la sunvenci??n""??????.. WTF.... ??Estos son los empresarios que el mercado acepta?#alucina_vecina",socialbro,3,6,4,3,3,1,3,6,4,,
566116,luis-sanz,4.35E+017,lsanza,Blameless PostMortems and a Just Culture - http://t.co/Er2IlZg79q,olapic,2,4,3,5,6,4,4,5,3,,
567059,luis-sanz,2.64E+017,lsanza,"""A tapestry of footage tracing the cosmic and biological origins of our species, "" Our story in 1 minute --&gt; http://t.co/16o1jOwt",olapic,5,6,5,3,5,4,6,5,5,,
568497,luis-sanz,8.5E+016,lsanza,Photo: The Empire State Building Goes Rainbow. http://tumblr.com/xl536pq9rk,olapic,3,4,6,8,7,6,5,4,6,,
571286,lvaro-sanmartn,2.89E+017,AlvaroSanmartin,"Los Reyes Magos vinieron a nuestra oficina: ""Seamos realistas y hagamos lo imposible"" http://t.co/jl4LxzZ3",floqq,2,5,4,2,3,5,1,3,4,,
571668,lvaro-sanmartn,2.24E+017,AlvaroSanmartin,There??s an angel in my life. http://t.co/r2b98JWr,floqq,3,4,3,5,3,4,4,4,4,,
572089,lvaro-sanmartn,1.09E+017,AlvaroSanmartin,"Busca la luz a??n en el lugar m??s sombr??o. Y si tampoco la encontraras, prueba a buscarla dentro de ti mismo... #profundonolosiguiente",floqq,1,1,3,1,2,3,1,3,3,,
572604,lvaro-sanmartn,1.95E+016,AlvaroSanmartin,"""La disciplina se gana desde el convencimiento, con normas y respeto. No con broncas, miedos y culpas q no sirven de nada"" #vicentedelbosque",floqq,2,1,2,2,2,2,2,3,2,,
