,Owner,id,screenName,Text,company,i1,i2,i3,p1,p2,p3,t1,t2,t3,,
573221,lvaro-sanmartn,5.35E+017,AlvaroSanmartin,"""Throw me to the wolves and I will return leading the pack"" #nofear http://t.co/Mk1jy4hc5A",floqq,3,3,4,2,4,4,2,3,4,,
573623,mahmoud-abdelkader,4.57E+017,mahmoudimus,"Everytime I see ""How to run"" or ""Installation steps"" in an age of #vagrant I get the rage.",balanced,3,4,4,6,8,7,7,7,6,,
574500,mahmoud-abdelkader,3.1E+017,mahmoudimus,"oh: ""today we had a 'sync and drink' which is different from our 'drink and sync'""",balanced,5,8,7,8,6,7,7,9,8,,
579366,marc-weil,2.12E+017,marcweil,AirPlay Mirroring. Mirror your display via an Apple TV at 1080p resolution without wires. Pretty neat. Also supports audio.  #wwdc,cloudmine,8,4,6,8,5,7,7,5,6,,
579372,marc-weil,2.12E+017,marcweil,The new Safari tab view looks really damn pretty. #wwdc,cloudmine,3,5,6,4,6,3,8,7,7,,
579410,marc-weil,2.12E+017,marcweil,New MBP has a quad-core i7 up to 2.7GHz. Up to 16GB of RAM. Up to 768GB of flash storage. Holy hell. 7h of battery life. #wwdc,cloudmine,5,7,3,7,6,4,6,5,4,,
580020,marc-weil,1.86E+017,marcweil,Believe nothing you see on the Internet today.,cloudmine,6,7,7,7,5,6,6,8,4,,
580855,marc-weil,1.44E+017,marcweil,"After drinking only french pressed coffee for 2 months, I find that I can barely stand drip. Blech. #firstworldproblems",cloudmine,6,8,6,3,6,4,6,5,5,,
582654,marcelo-calbucci,2.48E+017,calbucci,"RE: Hey Kevin, I don't think metrics are bad, but software development is a type of activity that's more like paintin??? http://t.co/xwTc0YrI",everymove,5,5,5,8,6,5,6,7,5,,
584377,mario-encina,2.26E+017,m_encina,Vot?? a Klooff como 'Mejor app m??vil' #CSA http://t.co/Hztv1bHJ,klooff,2,4,2,2,2,2,2,3,2,,
586901,mark-lawrence,2.74E+017,SpotHero,Tips to succeed in business: Adventure: Why Every Entrepreneur Should Live For It  http://t.co/jnLMxAEi #SpotHero,spothero,2,2,5,2,4,5,4,2,5,,
587637,mark-lynn,4.24E+017,MarkTLynn,Keftedes me Saltsa Domata (a.k.a. Greek meatballs) are deliciously loaded with mint and oregano. They're... http://t.co/aoy661h4Fl,20jeans,6,8,5,3,6,4,2,5,4,,
587955,mark-lynn,3.47E+017,MarkTLynn,No one will ever know it exists... http://t.co/NGQIQdUL05,20jeans,2,3,4,7,6,7,7,4,6,,
588347,mark-lynn,2.54E+017,MarkTLynn,"Her Malbec roots make for a ros?? that appears a brighter shade of pink, almost neon. The hue aptly foretells the... http://t.co/3e1lpPr2",20jeans,2,5,3,6,6,4,6,5,3,,
589442,mark-sawyier,2.17E+017,marksawyier,Instagramming from your glasses? Pretty wild! http://t.co/qJ7G4ESc,bonfyre,4,6,3,2,1,3,6,5,4,,
590483,mark-sawyier,12468902959,marksawyier,Back in nyc!,bonfyre,7,6,5,6,7,5,5,6,5,,
590831,mark-sawyier,840374478,marksawyier,Getting a proposal together for AT&T,bonfyre,3,6,5,8,7,5,5,8,5,,
591635,mark-thomas,5.44E+017,entrepreneurSF,My answer to What are the risks of taking a $1M bridge round from a strategic partner? http://t.co/sz9JA2Hq97,reesio,7,9,8,6,7,5,6,4,5,,
592263,mark-trang,4480967530,marktrang,Finally done with the assessment period of my DirectLife gadget. http://www.directlife.philips.com/,socialpandas,7,8,8,6,4,6,7,9,8,,
593057,marshall-kirkpatrick,5.12E+017,marshallk,"The smart, authentic, effective way to do influencer marketing: I'm doing a webinar about it! http://t.co/w7fXlrArNC",plexus-engine,2,3,3,7,7,6,5,5,7,,
594249,marshall-kirkpatrick,4.64E+017,marshallk,"Social bookmarking Delicious sold again, now to Science. Cool! http://t.co/JcNlC57u6q It could power great discovery: http://t.co/Q0cleR924Y",plexus-engine,6,6,6,7,5,6,7,5,6,,
594590,marshall-kirkpatrick,4.48E+017,marshallk,"I just saw a motorcycle club pull a guy out of a bar to beat him up, but he ran &amp; got away. Young fast guy w/ Prospect jacket had just left.",plexus-engine,1,3,2,8,6,7,4,4,5,,
595747,martin-henk,2.94E+017,nokkloom,I love the customer support calls that start like every other and end up completely blowing your mind. In the best positive sense possible.,pipedrive,3,2,6,7,8,5,2,6,4,,
596933,martin-tajur,1707183158,tajur,"Apple to buy Twitter? http://shrt.st/483 Well, given they have enough cash at bank even to buy Dell (http://shrt.st/484), why not.",pipedrive,3,4,5,4,5,6,7,7,7,,
597389,mason-blake,5.27E+017,mase,How Companies Can Protect Themselves When #Terminating an #Employee http://t.co/gbxLM7MBd2,upcounsel,3,6,5,8,8,8,6,4,4,,
598196,mason-blake,1937907973,mase,"Introducing Google Web Elements! 

Pretty sweet: google.com/webelements #googio",upcounsel,2,1,3,6,6,5,3,7,4,,
599852,massimo-chieruzzi,1.6E+017,MassimoCw,Perhaps illegal but surely very profitable #Megaupload ... have a look at the car seized: http://t.co/XQnNrqUf,adespresso,2,1,3,6,4,5,4,3,5,,
602408,matija-kopic,1.32E+017,matijakopic,Q5 Show why your farm and products are different. Make them different in life-changing and inspiring details. #agchat,farmeron,3,4,5,7,6,5,6,6,5,,
604055,matt-faustman,5.27E+017,MatthewFaustman,???Going to bed at night saying we've done something wonderful... that's what matters to me.??? - Steve Jobs,upcounsel,2,3,2,2,3,2,2,1,2,,
604177,matt-faustman,4.63E+017,MatthewFaustman,Funny whether or not you are a lawyer -- What Is a Photocopier? http://t.co/MVtx7pHiww,upcounsel,5,4,6,2,4,5,1,3,4,,
604385,matt-faustman,3.37E+017,MatthewFaustman,UpCounsel is Hiring Full Stack .NET Engineers http://t.co/VgeQ4v3WYS Know someone who may be interested? #dotNET,upcounsel,2,2,5,2,5,4,1,3,4,,
604684,matt-faustman,2.59E+017,MatthewFaustman,Seth Godin: How to get your ideas to spread http://t.co/ZyDgEQ74,upcounsel,2,4,6,8,7,5,8,7,5,,
605243,matt-faustman,1.24E+017,MatthewFaustman,Helpful post on choosing a legal entity for your startup.  Great links to helpful startup legal blogs. http://t.co/wxhHKliJ,upcounsel,4,4,5,7,8,5,5,5,5,,
606790,matt-friesen-2,1.83E+017,mattfriesen,"Totally want the???



Drake's London Untipped Woven Grenadine Silk Tie http://t.co/EaZdGVfz",wantering,2,4,2,2,4,3,2,3,1,,
607125,matt-friesen-2,1.22E+017,mattfriesen,Three keys that make interaction design great! http://ow.ly/6PsZw,wantering,2,3,2,8,7,9,8,7,9,,
607617,matt-friesen-2,9.92E+016,mattfriesen,#MountainDew is unleashing a new campaign in the UK that lets users create digital street art. http://ow.ly/5TKxK Go #Banksy!,wantering,6,4,5,7,8,9,8,6,5,,
609265,matt-harris-3,1299304010,mrmch,"No climbing this weekend :( Did try curling though! Very fun, a little different.",sendwithus,1,1,3,3,5,4,4,5,5,,
609392,matt-harris-3,993792408,mrmch,For good triphop see 4hero and 9 lazy 9!,sendwithus,2,3,4,3,1,3,4,6,4,,
610528,matt-heitzenroder,1.9E+017,roder,http://t.co/NOBr92hf makes me wonder if the retail investor has become accredited & left the public markets for the private equity markets,orchestrate-io,5,6,6,3,3,5,4,3,5,,
612467,matt-milosavljevic,4.11E+017,mmilo,getting nice and stressed to the max :(,bugherd,2,6,4,2,2,3,4,5,4,,
618661,matt-sandler,26797428749,mattdsandler,#wearenotworthy --&gt, Excited to announce our Featured Teachers! http://bit.ly/bERwKm,chromatik,6,6,5,4,5,4,3,4,3,
618970,matt-sandler,7658631084,mattdsandler,"Reneging on my previous ""cool"" statement. Having the spy skills = way cool. Having to use said skills in the line of duty = rough.",chromatik,4,6,5,4,5,5,6,5,5,,
619697,matt-talbot,1.51E+017,MattTalbot,cmon Broncos. special teams and defense look terrible so far.,gospotcheck,9,9,8,6,7,5,6,6,5,,
620988,matt-zitzmann,6742145384,mattzitzmann,Getting ready for my last big presentation of the year!,kamcord,7,5,6,7,4,5,6,7,5,,
622059,matthew-beebe,1794670718,matthewbeebe,Riding to work in a few minutes - and stopping at the Castro energizer station to volunteer for a while. See you there?,tylr-mobile,5,6,3,9,9,7,6,4,3,,
623230,matthew-goldman,3.67E+017,magoldman,There is too much favoriting and not enough retweeting these days on Twitter. Favorites do not lead to discover of new accounts to follow,wallaby-financial,5,4,6,7,9,6,8,5,6,,
623657,matthew-goldman,3.01E+017,magoldman,"I feel like there's a joke involving PSY, Strunk, White and the word ""style"" but it isn't coming to me",wallaby-financial,3,5,3,4,6,5,2,2,4,,
624098,matthew-goldman,2.13E+017,magoldman,The awesome new MacBook Pro with Retina display is so thin I would need to get a new laptop bag that actually can give it some cushioning!,wallaby-financial,5,8,6,7,7,5,9,8,7,,
632547,mert-iseri,1.22E+017,mhi,Memorial  http://t.co/ZW96QX5k,swipesense,2,2,4,2,3,4,3,2,4,,
632876,michael-bergman,1.61E+017,raysplace,Bree's beautiful lasagna http://t.co/yYFwhssY,repp,6,5,7,6,8,6,7,8,7,,
633953,michael-bergman,13913504709,raysplace,listening to some Nada Surf - Lucky,repp,2,3,4,5,5,4,5,5,4,,
634490,michael-bergman,2818232781,raysplace,Alas. . No hot chick next to me on plane.  Just vegetable lasagna.,repp,1,1,2,4,3,5,2,3,4,,
634534,michael-bergman,2150260312,raysplace,Wilco rocked . . . can't wait to see them again #fb,repp,3,2,4,7,4,5,7,4,4,,
634544,michael-bergman,2125077339,raysplace,nothing like a tatto on your face,repp,9,9,8,6,5,5,7,6,5,,
634697,michael-bergman,1342756198,raysplace,Weirdos at airport chose to sit next to us in gate while fifty extra seats are around.,repp,6,4,4,9,8,7,6,5,4,,
636079,michael-bleigh,2.18E+017,mbleigh,"In the battle of the ecosystems, no one wins.  http://t.co/a2dUy7f3",divshot,3,2,5,8,9,6,7,5,6,,
638815,michael-defranco,6.56E+016,MKeoniDeFranco,New Beastie Boys Album is Dope http://tumblr.com/xsb2dpesxx,lua-technologies,3,5,6,4,3,5,3,3,5,,
639497,michael-geller-2,5.42E+017,mgeller142,Decoding the causes of #customerchurn http://t.co/NIaupHUpxk,preact,2,3,4,5,7,5,7,5,5,,
641659,michael-mayernick,3.14E+017,mmayernick,Checkboxes that kill your product http://t.co/dtabVECgsZ,spinnakr,4,6,4,6,3,4,6,5,4,,
642639,michael-mayernick,1.29E+017,mmayernick,Have a Twitter app you'd like to showcase? Check out Twitter's official Washington DC Dev Teatime http://t.co/QHXrbun6  #dctech,spinnakr,3,5,4,3,3,4,9,8,7,,
643229,michael-nusimow,1224113061,nusimow,Winding down from a press conference with the mayor about Entrepeneurs & FastTrack.  My first press exposure ever!,drchrono,4,6,6,7,9,5,2,3,4,,
643975,michael-woodworth,22484112019,mwoodworth33,Top 50 Art and Design Trends in August 2010 - From Zig-Zag Haircuts to Creative Illusion Portraits (COUNTDOWN):  F... http://bit.ly/coIkLK,upverter,7,6,6,1,3,4,8,5,8,,
644101,michael-woodworth,8613772724,mwoodworth33,Top 20 Trends of the Day (Feb 3) - From Underbust Corsets to Grainy Beach Spreads (COUNTDOWN):   (TrendHunter.com)... http://bit.ly/ak8157,upverter,3,5,4,8,4,7,7,7,7,,
647474,mikalina-kirkpatrick,3.23E+017,Mikalina,Swinging https://t.co/0JXQhDknn0,plexus-engine,2,3,1,1,1,1,3,1,1,,
647935,mike-abraham,5.12E+017,getyounity,"Good review of the iPhone 6 and 6+: With Big New iPhones, It???s the iOS 8 Software Inside That Counts http://t.co/82I6i8bj1Y",younity,2,4,5,4,2,6,6,4,6,,
649224,mike-baukes,4.34E+017,mikebaukes,How much time do you spend connected to social media sites per day? #question,scriptrock-inc,5,7,5,4,7,5,2,3,4,,
649904,mike-gammarino,4.51E+017,MikeGammarino,Here are the American colleges???and majors???with the highest ROI ??? Quartz http://t.co/4Hy9leYclG,the-black-tux,2,4,4,2,6,4,3,5,3,,
651822,mike-kane,3759457062,Hedgeable,"He continued-- ""there is clearly enormous potential for inflation"" because of the buildup of reserves by central banks""",hedgeable,2,4,3,8,7,6,3,2,5,,
653030,mike-lewis,5.28E+017,TheReelist,Which one of the Marvel phase 3 films are you most excited for?,kapost,2,2,3,2,1,4,8,7,7,,
654883,mike-lewis,3.57E+017,TheReelist,"Video: Guillermo del Toro discussing, uh, 'Pacific Rim' ""robot porn"" http://t.co/7spTlfDgUO",kapost,3,5,4,6,8,7,2,1,3,,
655058,mike-lewis,3.53E+017,TheReelist,"'Sleepless in Seattle' Cast: A Look at Where They Are Now, 20 Years Later http://t.co/2n06hKtggS",kapost,2,2,4,6,7,8,7,9,4,,
655427,mike-lewis,3.46E+017,TheReelist,"Joss Whedon briefly discusses ""Much Ado About Nothing"" before getting grilled on ""The Avengers 2"" http://t.co/XosrLHKdMw",kapost,6,6,6,7,7,5,6,9,4,,
655663,mike-lewis,3.41E+017,TheReelist,The Most Extreme Drunk Benders in Movie History http://t.co/kCn0RnsQDi,kapost,4,8,5,6,8,5,4,3,5,,
655921,mike-lewis,3.35E+017,TheReelist,Why the 'Iron Man 3' sound department went to Toys 'R' Us http://t.co/obaW04JeNn,kapost,2,2,3,6,6,5,1,3,2,,
656637,mike-mccauley,3.51E+017,mmccauley,Cleveland's House for ice cream! http://t.co/Y9ymRdAqTb,bufferbox,3,6,3,7,2,6,8,7,7,,
657289,mike-mccauley,2.62E+017,mmccauley,What Goes Wrong - Founders at Work http://t.co/c6HR15of,bufferbox,3,5,7,7,7,6,7,5,6,,
658344,mike-mccauley,1.01E+017,mmccauley,Interested to see how the #Chromebook will fit into the netbook and tablet market - is this a product people are looking for?...,bufferbox,4,1,4,5,3,5,4,5,4,,
658377,mike-mccauley,9.3E+016,mmccauley,Another scorcher of a week coming up in #Waterloo http://yfrog.com/kgpatcjj,bufferbox,4,5,3,8,6,7,4,6,3,,
658513,mike-mccauley,4.79E+016,mmccauley,1/7 #RUTR,bufferbox,1,2,2,1,4,2,1,3,2,,
658552,mike-mccauley,3.35E+016,mmccauley,Today is going to be a good day!! ONE MORE DAY!!!! Let's get this party started #fb,bufferbox,1,3,5,7,4,5,6,6,5,,
658730,mike-mccauley,3947249422,mmccauley,Solid day of surfin at Pacifica and now have a wetsuit. 80s party tonight!!,bufferbox,5,5,5,3,4,4,2,6,4,,
660463,mike-winn,3.39E+017,mikewinn,Best new application for drones: Herding Sheep.Please someone build an app for that on DroneDeploy! http://t.co/WgNqo1s5m7,dronedeploy,2,3,6,7,9,8,2,4,4,,
660587,misha-talavera,3.93E+017,MishaTalavera,"men, always carry chocolates. and watch your step. #zoochosis http://t.co/NNweUCWVES",neoreach,2,4,3,7,9,8,7,8,8,,
661948,moisey-uretsky,4.95E+017,moiseyuretsky,"Fear is the unlearning of old habits, beliefs, and ways of being. To defeat fear, listen to it, accept what it says, &amp; push forward anyway.",digitalocean,3,2,2,8,7,8,7,6,8,,
667378,muhannad-taslaq-2,3.16E+017,MuhannadTaslaq,#GameDraw for #unity3D has a new Chennel http://t.co/Dt31jGvQs3 check out great demos for #3Dmodeling inside the #unity3D Engine cc #GDC2013,mxd3d,5,7,6,6,4,5,8,9,7,,
667805,muhannad-taslaq-2,2.65E+017,MuhannadTaslaq,"#GameDraw runtime API #documentation will be delivered to our customers soon, we added spices to our product but it's worth it #unity3d",mxd3d,5,7,5,3,5,4,1,3,4,,
668320,muhannad-taslaq-2,2.47E+017,MuhannadTaslaq,As a #realmadrid I believe that some players should be kicked of team and their salaries should be used to revive the #spanish #economy,mxd3d,2,4,5,8,9,8,9,9,8,,
670144,nadim-hossain,3.84E+017,NadimHossain,Baby's diaper = what I'm hoping for in Stanford vs WSU: a blowout. #tmi #newdad #gostanford,brightfunnel,2,5,4,8,6,7,8,7,6,,
670731,nadim-hossain,3.45E+017,NadimHossain,"I just left a comment in ""Marketo???s First Launch Since IPO Is A Machine Learning Engine For Social??Campaigns"" http://t.co/lktSJJTyZf",brightfunnel,3,2,5,5,3,3,6,6,4,,
671525,nadim-hossain,1.94E+017,NadimHossain,"B2B IPOs in ""big, established markets where revenues are dependable. Online consumer companies are...flashy""  http://t.co/VkrEvOi2",brightfunnel,7,5,4,4,6,3,5,7,4,,
673174,nancy-hua,4.36E+017,HuaNancy,"""I understand not liking the food. I don't understand not eating it anyway.""",apptimize,5,7,6,2,4,5,5,2,5,,
673183,nancy-hua,4.32E+017,HuaNancy,"""Oh I wasn't counting my sort of ex-girlfriends. Only the ones who *really* never want to talk w me again.""",apptimize,2,2,4,2,5,4,3,6,4,,
677893,nicholas-molnar,6.87E+016,nickmolnar,"""Interactivity. Many-to-many communications. Pervasive networking. These are cumbersome new terms for..."" http://tumblr.com/xoi2hnxcpw",wantering,3,3,5,3,5,4,3,6,4,,
678696,nicholas-molnar,18802550541,nickmolnar,"The DJ at Alta lake is really hitting the spot. So much great 90s house music. Fatboy Slim, Armand Van Helden, FunkstarDeluxe. Hell ya",wantering,2,3,5,4,5,6,7,5,6,,
679338,nicholas-molnar,10791706983,nickmolnar,"Oh god, so many tough decisions on who to see tonight. No more 2nd chances. Best band with the worst marketing: who is it?",wantering,8,8,7,5,5,6,5,7,5,,
679626,nicholas-molnar,8816717997,nickmolnar,"http://tinysong.com/9ndM



Putting your life back together after a crazy-assed-Superbowl music",wantering,2,4,6,6,8,6,8,6,7,,
679834,nicholas-molnar,7923860529,nickmolnar,Imagine how cool it would be if Conan used his $40m severance package to crush The Tonight Show w/ a killer online program.,wantering,2,4,3,8,9,7,7,5,3,,
680370,nick-alexander-3,19762836575,nick_alexander,invites you to visit an abalone farm. Do it on Qenso. http://www.qenso.com/t/24272222,freshplum,4,6,6,4,5,5,3,5,4,,
680484,nick-cairns,5.15E+017,niccai,We have a growing list of fashion retailers on Wantering.  Do you have a favorite store you'd love to have added? http://t.co/GwfUbYOaDI,wantering,4,3,3,7,7,6,5,4,3,,
681257,nick-cairns,3.9E+017,niccai,That GoDaddy news is interesting.,wantering,4,5,6,4,4,5,5,3,6,,
681581,nick-cairns,3.55E+017,niccai,"CSS filters, GIFs, and performance - scaling of a background with the GPU is a clever idea. https://t.co/BIZ7Ws98w4",wantering,5,3,4,6,5,4,3,5,4,,
681922,nick-cairns,3.07E+017,niccai,Nice ring around. #brutal,wantering,2,4,3,6,5,4,3,7,5,,
682328,nick-cairns,2.63E+017,niccai,I wonder which Instagram account will be the first to win the Pulitzer Prize.,wantering,3,5,6,6,7,5,7,5,5,,
683225,nick-edwards-2,12253990976,nicholasedwards,Software Is Media http://ff.im/-j5eyu,boomtrain,8,9,7,6,6,5,6,8,6,,
683475,nick-edwards-2,2387657984,nicholasedwards,"""The model goes something like this: Find a vertical with an audience attractive to advertisers, brand it..."" http://tumblr.com/xi826r9y1",boomtrain,8,7,6,7,8,7,9,8,7,,
683780,nick-mehta,4.95E+017,nrmehta,We took a stab at answering one of the top questions I get from CEOs - job description for a VP #customersuccess http://t.co/YqwtvbEnyo,jbara-software,3,4,4,2,1,4,2,3,4,,
683968,nick-mehta,4.74E+017,nrmehta,"If you missed our #customersuccess best practices event #pulseconf2014, we put every video &amp; slide deck online here: http://t.co/TAEtCcSeSo",jbara-software,2,3,4,6,7,5,6,5,6,,
684331,nick-mehta,4.26E+017,nrmehta,Top 85 people in world have more wealth than bottom 3 billion. Wow.  http://t.co/z3CvJJMGdo,jbara-software,2,3,4,7,5,4,5,6,4,,
687018,nicolai-watzenig,2.04E+017,Lindroos,"Who today, after all, asks whether they were popular, the Fuggers, the Medici and the Rothschilds? Oliver Samwer http://t.co/Dqr6J7R9",birdback,2,3,4,7,5,4,6,2,4,,
687333,nicolai-watzenig,1.82E+017,Lindroos,The 6 Habits of True Strategic Thinkers http://t.co/6fcYGrv3,birdback,4,8,6,7,7,6,3,3,4,,
687670,nicolai-watzenig,1.6E+017,Lindroos,"I'm at The Lost Church (65 Capp St, San Francisco) http://t.co/vId01qsz",birdback,3,4,3,4,6,5,6,6,5,,
687923,nicolai-watzenig,1.33E+017,Lindroos,The New Science Behind Your Spending Addiction http://t.co/VdKIJnzn,birdback,5,3,4,6,5,4,5,4,4,,
687976,nicolai-watzenig,1.27E+017,Lindroos,European online shoe store http://t.co/YiJnh13a projects ???100 million turnover this year http://t.co/TLmXgwIk,birdback,8,4,7,7,6,5,5,4,6,,
689946,nikhil-sethi,8320000000000000,nsethi,This is a spark of genius? Really? http://on.mash.to/fYkgCx,adapt-ly,8,6,6,8,6,5,1,1,3,,
690073,nikhil-sethi,27773762559,nsethi,She bruised her knee and I said how are you http://instagr.am/p/Cbeh/,adapt-ly,2,3,4,5,7,5,1,1,2,,
690153,nikhil-sethi,19936570592,nsethi,Google Voice is disconnecting a lot of my calls. Anyone have an idea why?,adapt-ly,1,2,2,7,5,6,4,6,5,,
690332,nikhil-sethi,7076805847,nsethi,May your head explode. http://bit.ly/59r553,adapt-ly,3,4,3,3,4,4,2,1,3,,
690379,nikhil-sethi,5247329628,nsethi,Watch the evolution of the international space station! http://bit.ly/2BrU3,adapt-ly,3,2,4,8,7,8,7,6,8,,
692034,nisheeth-ranjan,2.76E+017,n_ranjan,"I'm a happy, satisfied customer of Cygnette's iPhone 5 case: http://t.co/2cXpZvDv",brightfunnel,9,7,5,5,5,5,7,7,5,,
692865,noah-slimak,5.39E+016,nslimak,Facebook seems to be unstable today... Any info on this?,piictu,3,2,4,3,2,4,2,2,4,,
693545,omar-bohsali,4.41E+017,omarish,has anyone tried correlating BTCUSD with a volatility index such as VIX?,priceonomics,1,2,3,6,7,5,5,3,3,,
694719,omar-bohsali,890969147,omarish,up a bit early, at greenberry's enjoying the morning,priceonomics,6,3,5,2,6,4,3,3,3,
694834,omar-bohsali,808294073,omarish,out for a bit,priceonomics,2,4,2,2,3,2,2,4,2,,
695563,pablo-orlando,4.27E+017,orlandopablo,"Dato: 1.3 y 1.6 mill??n de visitantes ??nicos por d??a, traducido a rating televisivo, da un acumulado de entre 12 y 14 puntos...interesante",gone,2,4,5,3,2,4,2,4,4,,
696069,pablo-orlando,3.14E+017,orlandopablo,GoodPeople Argentina | Goodpeople http://t.co/PFgFr0AGNI,gone,2,1,4,2,1,4,2,5,4,,
696383,pablo-orlando,2.49E+017,orlandopablo,iOS6 :),gone,1,2,2,6,5,4,2,4,2,,
696442,pablo-orlando,2.42E+017,orlandopablo,Comprate una electrica 1.5k a 3k http://t.co/f5vdSmgg,good-people,3,2,4,1,1,4,2,1,4,,
696685,pablo-orlando,2.16E+017,orlandopablo,"que ganas de poder ver este partidito! Messi y Falcao ser??n los protagonistas de la ""Batalla de las Estrellas"" http://t.co/1QiKFvl3 via",gone,1,4,1,1,2,1,1,1,1,,
697586,pablo-orlando,1.1E+017,orlandopablo,esto es lo bueno de estar en SFCO! no solo que voy sino que encima caminando! I've made plans for TechCrunch Disrupt: SF http://t.co/0NuKMwr,good-people,4,6,5,6,6,5,5,4,4,,
697590,pablo-orlando,1.1E+017,orlandopablo,Con el one-click shipping de amazon compras casi sin darte cuenta! Va basicamente te compra solo y despues deja q lo canceles! ,),good-people,2,3,3,2,2,3,2,2,3,
702274,patrick-collison,5.12E+017,patrickc,This is great: http://t.co/Y5glJr69uY.,stripe,3,5,3,3,5,4,3,1,3,,
704350,patrick-collison,3.7E+017,patrickc,It's fun to see the ecosystem develop around Stripe Connect. Kabbage + Stripe Connect ??? instant loans. https://t.co/zxBJt7zThV,stripe,5,4,4,6,5,4,5,4,4,,
704665,patrick-collison,3.42E+017,patrickc,"If you're not in LA, http://t.co/rrocavsdzH is a great piece about it.",stripe,4,5,6,6,4,5,6,4,5,,
704944,patrick-collison,3.06E+017,patrickc,http://t.co/mP2GRX1oYd,stripe,2,2,1,2,3,1,2,3,1,,
705939,patrick-riley,6376126480,patrickfriley,"Mitch Kapor says no one envisioned Wikipedia a few decades ago?!  How about Vannavar Bush's ""As we may think""  from the 1950s?  #fotf.",ark,3,6,4,6,5,7,8,7,7,,
706273,pau-sabria,2.46E+017,kuap,This should be on your to-do list for today http://t.co/nB9jduKh,olapic,3,4,5,3,4,5,6,7,5,,
707838,pau-sabria,27307138191,kuap,"Comic for October 13, 2010 http://is.gd/g19L3",olapic,8,9,7,7,8,7,7,9,8,,
708093,pau-sabria,10521126924,kuap,Old plain mail - I???ve been exchanging letters with my grandfather for a while now. Old style communication is... http://tumblr.com/xf67fyd3n,olapic,3,2,4,2,5,4,2,6,4,,
708869,paul-armstrong,5.05E+017,wiseacre,"I feel like my face is trapped inside another older, fatter face.",choremonster,3,5,3,6,4,3,7,6,4,,
709990,paul-armstrong,4.51E+017,wiseacre,Still accurate http://t.co/oSstGdcb5S http://t.co/VUAC5Gq5By,choremonster,6,4,5,7,6,5,7,6,5,,
710148,paul-armstrong,4.44E+017,wiseacre,The best way to solve a design problem is to find a good solution. #pointlessdesignadvice,choremonster,9,9,8,7,8,6,6,4,5,,
710467,paul-armstrong,4.34E+017,wiseacre,Chicken is the lettuce of meat.,choremonster,7,8,6,5,6,5,6,4,5,,
711128,paul-armstrong,4.15E+017,wiseacre,"Installed a little Chrome extension called ""Hola"" and it's already changing my life in the most shallow way one could imagine.",choremonster,4,3,6,4,5,5,2,2,4,,
712960,paul-arterburn,11425605666,parterburn,Google never asked to use my image for their Topeka name change! http://bit.ly/cUFsTn #1G4Topeka,brandfolder,4,6,5,4,6,5,8,6,5,,
714459,paul-berberian,11038369695,pberberian,It really pisses me off when a VC won't return a call or email but is more than happy to put you on their BS spam newsletter list,orbotix,7,7,6,5,5,5,2,3,4,,
714473,paul-berberian,7569529782,pberberian,F-18 at Chyenne 40 feet away - going home from training getting ready to deploy  http://twitpic.com/xetcx,orbotix,5,8,7,7,5,6,8,9,7,,
714520,paul-berberian,2568585081,pberberian,"da de da, da da da de da de da de da, da da - Harry Potter preview today - I'm in the mood",orbotix,1,7,7,8,4,7,8,6,7,,
714699,paul-berberian,625759472,pberberian,At saxys waiting for the higgley of iggley,orbotix,6,6,6,9,7,6,2,5,4,,
714756,paul-berberian,380542212,pberberian,"Sitting at home waiting for a ride bcuz renee""s pos toureg is in the shop again",orbotix,2,1,2,4,2,3,4,3,2,,
715010,pavel-khodorkovskiy,3.6E+017,pmhburyatia,"I posted 6 photos on Facebook in the album ""Enertiv Photos"" http://t.co/fLNHWFKVMQ",enertiv,2,3,6,7,6,6,6,7,5,,
715653,pete-moore-2,3.44E+017,askpete,Get a Ninja Block kit shipped immediately on Grand St with 3 free sockets. Use this link https://t.co/hSrAwErrXF to get $15 off.,ninja-blocks,7,9,6,8,7,5,9,7,6,,
716761,peter-seid,1.79E+017,pwseid,Really awesome tour of Richard Garriott's house/private museum :0 (the creator of Ultima) http://t.co/vYILSijS,romotive,3,3,3,8,6,6,7,5,6,,
718116,philip-brown-2,12161618506,philipdbrown,I think it is let your dog hang out the window day.  I saw several on the way into the city.,supplyhog,2,4,2,6,4,5,4,2,5,,
719665,philippe-laval,3.84E+017,PhilippeLaval,10 Reasons Your Startup Will Fail  http://t.co/F6LCpGksMx,kwaga,3,4,3,1,2,3,8,8,7,,
719902,philippe-laval,3.56E+017,PhilippeLaval,BackOps Raises $7M To Build An Army Of Moms For Managing Startups And Small Businesses With L??? http://t.co/BdVNYj4Qkt,kwaga,7,9,6,8,9,6,6,8,6,,
721256,philippe-laval,5.46E+017,PhilippeLaval,Brand new feature: no need to forward your booking emails anymore #kwaga #feedly http://t.co/72tbVFSlDR,kwaga,8,7,6,9,7,8,4,1,2,,
722070,piragash-velummylum,4.7E+017,piragash,"If you are ever in #Seattle, you should try a dutch baby at Tilikum Place Cafe. #breakfast http://t.co/9XQ6NObn6h",wire-labs,3,3,5,6,5,5,3,5,4,,
724231,pradeep-elankumaran,1.88E+017,pradeep24,Jack White http://t.co/AcDFzlGO,kicksend,2,4,2,5,4,4,3,1,3,,
