,Owner,id,screenName,Text,company,i1,i2,i3,p1,p2,p3,t1,t2,t3,,
292229,erine-gray,8.25E+016,AuntBertha,books inform the work. the work is informed by the ppl. ppl are the purpose of the work. #businessplan,aunt-bertha,4,2,4,6,6,5,5,4,4,,
292301,erine-gray,8.06E+016,AuntBertha,"Good Morning, Do-Gooders!",aunt-bertha,1,3,1,1,2,1,1,1,1,,
293512,esther-park,1114619004,estherpark,still at the office...trying to make some lemonade with a bunch of lemons,tastemaker,3,4,5,4,2,5,6,3,5,,
294893,ethan-austin,3.96E+017,ethanaustin,Happy day after Halloween http://t.co/VagKiOpOk7,giveforward,3,2,4,7,4,4,8,7,6,,
297235,ev-kontsevoy,1.27E+017,kontsevoy,Playing with #AeroFS. The thing smells quality.,mailgun,4,3,3,3,3,3,2,4,3,,
297742,evan-konwiser,4.23E+017,evankonwiser,Envoy for a regional airlines is almost as bad as Endeavor. What are these people thinking???,flightcaster,2,4,2,4,5,3,3,5,4,,
298548,evan-konwiser,2.63E+017,evankonwiser,Scrabble by candlelight. This time power really is out! http://t.co/SFBzKijH,flightcaster,6,8,6,6,4,5,7,7,6,,
299647,evan-konwiser,11094624821,evankonwiser,The only place airlines want to compete is in regulatory decisions http://post.ly/VeqE,flightcaster,2,1,3,7,9,8,5,7,6,,
299876,evan-owens-2,2.61E+017,Captain_Owens,"The Art of Ass-Kicking: The Most Memorable Quotes (I Could Capture) From Startup School 2012, http://t.co/VnhODrBW",pogoseat,7,7,6,9,6,5,9,6,5,,
300355,eyal-molad,2.44E+017,EyalMolad,Great performance by #audiocommon #Mitdemoday !!,cartcrunch,2,4,6,6,8,5,6,7,4,,
300582,fayez-mohamood,3.69E+017,Fries_NO_R,Brett Hurt on scriptogr.am http://t.co/jCsGCbiOUl,triggermail,4,7,6,3,1,4,3,3,4,,
300669,fayez-mohamood,3.08E+017,Fries_NO_R,What Coke Contains ??? Food for Thought ??? Medium http://t.co/Ircs6XiFsc,triggermail,6,8,4,4,5,4,3,2,4,,
302642,felix-sheng,3.02E+017,felix,"Browser wars are thankfully no longer about how to render html/css - it's the #javascript engine, the ui, making downloading faster, etc...",ordr-in,2,4,5,3,5,4,7,5,6,,
303753,fernando-cuscuela,5.02E+017,fercus,5 lessons for #entrepreneurs http://t.co/sDKj5q3cQb,everypost,4,5,6,8,7,6,3,1,5,,
304234,fernando-cuscuela,2.97E+017,fercus,"I'm using Everypost, a mobile app that allows me create and share content simultaneously to multiple social networks. http://t.co/eja32g0W",everypost,7,6,5,2,4,4,7,5,5,,
304311,fernando-cuscuela,2.69E+017,fercus,Ojal?? hoy se repita! Vamos Boquita! Ponga huevo carajo!!!! http://t.co/JODQpgpo,everypost,6,9,5,6,8,4,5,5,5,,
306667,florian-motlik,2.55E+017,flomotlik,"Running nested #tmux sessions gives me a feeling of superiority. Don't know why, or of whom, but strangely superior. :D",codeship,3,2,3,5,8,4,6,2,4,,
307174,frdric-della-faille,5.02E+017,fredd,It takes two years to learn how to prepare sushi rice. Patience is a virtue.,checkthis,5,7,6,4,5,5,7,8,5,,
308895,frdric-della-faille,3.91E+017,fredd,Alamo Square http://t.co/qypqX1KSSX #frontback,checkthis,2,3,4,2,5,4,2,5,4,,
310637,frederick-cook,3.67E+017,frederickcook,Injectable oxygen http://t.co/iW7uso8pfm,moveline,3,4,5,1,3,5,4,3,5,,
311666,frederick-cook,2.19E+017,frederickcook,Bikers... and bikers. http://t.co/Q1yllT2N,moveline,2,2,1,2,3,1,2,2,1,,
313853,frederick-townes,1.83E+017,w3edge,From back in 2008: Understanding Progressive Enhancement http://t.co/sysHUjU2 to today: http://t.co/eL2jiMSn,placester,7,8,8,6,6,6,4,6,5,,
316826,gabe-lozano,2.87E+017,gabelozano,I am now a fan of The MLB Memes Network on LockerDome http://t.co/qV8N1IGo,lockerdome,3,5,6,5,7,6,5,7,6,,
317212,gabe-lozano,2.44E+017,gabelozano,Just forced myself to listen to a song with whistling. Not sure I can get used to this. #stilltheworst,lockerdome,7,8,6,7,4,6,5,5,6,,
317618,gabe-lozano,1.91E+017,gabelozano,I firmly believe that all these ridiculous biz plan competitions need to be replaced with product competitions.,lockerdome,5,7,5,3,5,4,4,8,6,,
321351,gaurav-sharma-6,2.25E+017,g0g0,Good news everyone (in professor farnsworth's voice). iOS6 doesn't take 5 hours to browse pictures on your phone. Yay!,chute,5,5,5,3,2,4,2,3,3,,
321519,gaurav-sharma-6,2.14E+017,g0g0,It's funny how a game which can jun just fine on a 7 year old XBox gives 2 FPS on a $1600 Mac!,chute,3,5,5,6,5,4,6,4,4,,
321623,gaurav-sharma-6,1.86E+017,g0g0,"Computer feeling slow(ish). Upgrade your HDD to a SSD, you will be blown away with the performance difference.",chute,7,8,6,5,5,4,6,5,6,,
321722,gaurav-sharma-6,1.78E+017,g0g0,Unreal Engine is Super Cool. Wish I could do game programing. http://t.co/zvsA8r0G,chute,3,5,4,5,3,5,5,7,5,,
322049,geoff-mcfarlane,1.7E+017,geoffclubw,Just posted a photo http://t.co/gqk9Fcg5,clubw-com,5,7,6,7,8,6,6,6,6,,
322454,geoff-watts,2.91E+017,geoffwatts,"New J.W. Anderson menswear collection is daring, but not sure I'd pull it off #peplum #moobtube #shiftdress #menswear",editd,3,1,5,7,5,5,4,1,5,,
323920,geoffroy-simon,6.28E+016,Getyoo,"Opus MiniTrailer 2/3

http://vimeo.com/22330812 http://fb.me/WAhOWPq3",tagtagcity,7,6,6,2,3,5,1,3,4,,
324042,geoffroy-simon,7060000000000000,Getyoo,Click the circle and get online information #EWEA European Wind Energy Association (EWEA) http://fb.me/uVpYY7TU,tagtagcity,6,5,3,7,6,4,5,3,5,,
324925,gillian-tee,8.22E+016,TenPearls,Celebrate Father's Day by downloading the Father's Day Nokia theme... http://fb.me/BczdVg8o,rocketrip,5,4,6,4,5,6,4,5,6,,
325271,gino-zahnd,5.05E+017,gino,"Portland-based Coolest Cooler has now raised the largest Kickstarter in history. $10.6mil.



I totally want one. 



https://t.co/TiEWvdAaGw",cozy,1,3,2,8,6,6,5,4,6,,
325722,gino-zahnd,4.62E+017,gino,"Is there a single example of human-centered design resulting in a leap in innovation (vs. incremental improvement)? 



I cannot think of one.",cozy,2,3,2,6,5,5,5,7,4,,
326045,gino-zahnd,4.3E+017,gino,Northern California has shut off the water supply to SoCal. (Shouldn't be doing this anyway.) http://t.co/j80j5gnuCI,cozy,8,9,6,7,7,5,6,5,6,,
328048,glenn-ericksen,3.71E+017,glennericksen,What is the deal with straw wrappers that are so tightly secured you literally have to peel them off? -&gt, Drinking from a broken straw.,faithstreet,2,4,3,6,7,4,5,2,4,
328537,glenn-ericksen,5.35E+017,glennericksen,It's not enough to start out great. Becoming the best is awarded to those that are willing to get better. http://t.co/KVly5uAfCM,faithstreet,2,3,4,5,2,4,7,6,4,,
328679,grant-feek,3.12E+017,gfeek,I'm hiring! Sales Executive - Venture Backed Startup at Tred - Greater Seattle Area #jobs http://t.co/5R5ssCRdDU,tred,4,5,6,5,3,5,5,4,6,,
328863,grant-feek,1.04E+017,gfeek,madeon mashup: http://t.co/BCD4zwk,tred,2,3,4,2,4,4,2,3,4,,
330714,gregarious-narain,2.49E+017,gregarious,"I'm at Single Origin Roasters (Surry Hills, NSW) w/ 6 others [pic]: http://t.co/DxJRi8L0",chute,3,5,4,4,3,4,3,2,4,,
330829,gregarious-narain,2.36E+017,gregarious,"Get out of your comfort zone, it's where the magic happens - http://t.co/fH4WZwrD",chute,6,7,5,5,3,4,9,8,7,,
331261,gregarious-narain,1.89E+017,gregarious,Yay! Layover. (with Maria at Charlotte Douglas International Airport (CLT)) ??? http://t.co/Su0BK9vJ,chute,2,4,3,3,2,4,1,2,3,,
334265,gustavo-guida-reis,6.79E+016,gusguida,"Sorry FaceTime, Windows Phone 7 Just Beat You (MSFT, AAPL) http://bit.ly/iJL6Cz",btcjam,2,1,3,7,5,7,7,5,6,,
335089,gustavo-guida-reis,848547457,gusguida,Nada de iPhone 3G em lojas dos EUA sem ativacao. Agora nos resta esperar o mercado negro ou a Claro resolver vende-los aqui...,btcjam,2,4,4,3,6,4,3,1,4,,
335931,hampus-jakobsson,2.45E+017,hajak,"25 mobile design inspiration sites: 

http://t.co/CnMWmxqn",brisk-io,8,5,6,5,5,6,5,7,6,,
338214,hany-rashwan,3.42E+017,hany,Neymar!,ribbon,1,2,2,1,3,2,8,9,6,,
340044,hardi-meybaum,4.58E+017,hardi_meybaum,Facinating article about bots http://t.co/ReqdEViqwC,grabcad,7,9,6,3,1,4,2,3,4,,
342187,harry-zhang,5.48E+016,harryzhang,What a fantastic night - now I'm stuck in the library because a gunman is running amok less than a block away. Thank you Ann Arbor #lockdown,lob,3,5,3,6,8,5,4,7,6,,
342871,heather-marie,3.66E+017,HeatherMarieNYC,Interesting genuine chat w Elon Musk and #RichardBranson on entrepreneurship http://t.co/GlvuPgkAha  #startups #entrepreneur,72lux,3,1,2,6,6,6,7,5,7,,
343320,heather-marie,2.89E+017,HeatherMarieNYC,Deborah Needleman Names Style Director for T Magazine: http://t.co/bvLDFoAh #media,72lux,4,6,6,6,6,5,3,4,4,,
343624,heather-marie,2.5E+017,HeatherMarieNYC,Truth about entrepreneurs: http://t.co/EWnTULFQ http://t.co/KQvj0kv3,72lux,7,9,6,7,9,6,7,5,6,,
344085,heather-marie,1.96E+017,HeatherMarieNYC,DVF headquarters  http://t.co/qY1N1qnD,72lux,7,5,6,5,5,5,2,3,4,,
347610,hunter-hammonds,1.86E+017,hunterhammonds,Can't wait to get to know more awesome local entrepreneurs.,impulcity,2,4,4,3,5,4,5,6,4,,
348066,iaki-abete,2.03E+017,inakiabt,"""M??s votos que la anterior vez"" Mauricio Macri",gone,2,3,3,1,3,3,5,4,3,,
348236,iaki-abete,1.93E+017,inakiabt,"Jade Mountain, un para??so de 2020??? la noche. Pagable. http://t.co/bchx3uT0",gone,2,1,2,3,5,3,3,4,2,,
349050,iaki-abete,8.8E+016,inakiabt,"Me cuesta mucho no responder en Facebook los ""Gracias a todos por los saludos!"" con un ""Chupala!"" o un ""TROLO"". Es m??s fuerte que yo",gone,3,5,3,4,4,3,2,5,3,,
349178,iaki-abete,8.37E+016,inakiabt,Quiero llegar a los 35. Mis razones para no ver a River hoy,gone,2,5,3,2,4,2,1,2,3,,
349892,ian-hogarth,4.82E+017,soundboy,"Interesting interview with andreessen on Piketty, IPOs &amp; the stock market in general: http://t.co/rbPf0tzeDI",songkick,4,5,4,6,4,5,6,6,6,,
350171,ian-hogarth,4.34E+017,soundboy,all i want for valentines day is non-shitty hotel wifi #luv #connection,songkick,6,6,6,4,6,5,7,5,5,,
350227,ian-hogarth,4.23E+017,soundboy,"""It was more about building a platform on top of music--because music, we realized, sells everything but music."" http://t.co/EuqK78DcHL",songkick,3,4,3,3,1,3,9,2,3,,
351041,ian-hogarth,2.96E+017,soundboy,"2 thoughtful economists both focus on the music industry today: Cowan: http://t.co/0K6jdS1p, Yglesias:

http://t.co/GDx4TVkX",songkick,4,3,6,6,7,5,5,6,6,,
351079,ian-hogarth,2.91E+017,soundboy,"very interesting to see more tech companies opening high st retail stores (e.g. Moo, Microsoft), just as traditional high st is collapsing.",songkick,2,4,3,6,6,5,6,6,6,,
353169,ian-livingstone,3.34E+017,ian_livingstone,"Top 5 game app on iOS requires 150,000 downloads a day says Tommy Palm of King. Facebook enables cross-platform viral user acquisition #gmeu",playmob,5,8,6,4,6,5,2,1,4,,
353291,ian-livingstone,2.97E+017,ian_livingstone,People are here! Phew! http://t.co/WBvMi0v6,playmob,1,2,1,3,5,4,2,4,2,,
353727,ian-livingstone,2.4E+017,ian_livingstone,"Today is the 30th anniversary of The Warlock of Firetop Mountain. Zagor is very grateful for all the birthday wishes, thank you!",playmob,6,6,5,4,5,4,3,1,4,,
354632,ian-livingstone,11044870763,ian_livingstone,#culturallybritishtaxbreakgames Professor Leyton Orient,playmob,5,7,4,8,7,5,1,1,3,,
358828,ian-storm-taylor,1.59E+017,ianstormtaylor,User experience consideration: copy-paste pieces of your app that people might want to share/note to make sure they paste intelligibly.,segment-io,1,1,3,8,8,6,6,4,5,,
358968,ian-storm-taylor,5.57E+016,ianstormtaylor,Damn non-disclosure agreement prevents my teacher from talking in depth about a really interesting old project. Those things should expire.,segment-io,7,5,6,7,6,6,8,7,8,,
359153,ian-storm-taylor,24942250193,ianstormtaylor,"Sick of WebAdvisor's interface? Well you don't have to look at it anymore!



http://ianstormtaylor.com/discussed/webadvisor-simplified",segment-io,5,6,4,4,1,3,6,9,7,,
359482,ian-storm-taylor,5596222707,ianstormtaylor,"Am I the only one disappointed with the ""Empire State of Mind"" music video? Great song... horrible video. #jay-z",segment-io,2,3,3,6,6,6,3,2,2,,
360940,ilya-sukhar,4.92E+017,ilyasu,DNS + Blockchain. Pretty neat. http://t.co/23ATagsN2q,parse,5,7,6,7,4,5,4,3,5,,
364983,itai-danino,5.5E+017,itaidanino,#live on #Meerkat http://t.co/Okfa4hZ6vZ,yevvo,2,2,2,8,7,7,7,8,7,,
366044,jack-wrigley,4.87E+017,jackwrigley,Lindsay Taylor Hollywood video 4 your product/biz http://t.co/druN22ncUq #shopsmall BUY NOW CAD $999.00 http://t.co/W1kWGoSehU,qwiqq,6,5,4,5,3,4,4,5,4,,
366187,jack-wrigley,4.76E+017,jackwrigley,Increase Same Store Sales through Employee Advocacy https://t.co/eGbNHtxl0d,qwiqq,2,4,3,5,7,4,3,5,3,,
366271,jack-wrigley,4.65E+017,jackwrigley,If you don't build your own dream someone else will hire you to build theirs. #entrepreneur #truth #socialmedia,qwiqq,3,3,3,8,5,6,7,6,7,,
366295,jack-wrigley,4.62E+017,jackwrigley,.#Swarm http://t.co/ZEW4oykdJs,qwiqq,3,6,4,4,6,4,2,5,4,,
368511,jack-wrigley,5.35E+017,jackwrigley,It's ok. Be the retriever sometimes. https://t.co/AeftlY59GG #startup #ShopSmall,qwiqq,4,7,6,6,7,5,3,6,5,,
369831,jacquie-phillips,1.84E+017,jacqsified,"the moustache has run it's course, no? what's the next symbol of douche-y cool?",lifecrowd,4,8,5,3,3,4,4,5,3,,
370344,jacquie-phillips,16516150072,jacqsified,for the Sporty Dad (in honor of the US Open this weekend!) cool polos from Lacoste http://bit.ly/9WYA1u,lifecrowd,3,8,5,3,5,4,2,3,4,,
370498,jacquie-phillips,9708564141,jacqsified,http://twitpic.com/15jimr - friday inspiration: SF sunset after a day o' rain,lifecrowd,1,2,4,3,4,4,3,3,4,,
370997,jacquie-phillips,2860236508,jacqsified,shop without sin sunday! thousands of cute v-neck tees on sale from hundreds of different brands http://bit.ly/fLr23,lifecrowd,4,6,5,7,9,6,8,8,6,,
371368,jacquie-phillips,1996893890,jacqsified,our friends at shopflick got bought by the media empire that is Sugar.  wowza! http://bit.ly/Rzd3c,lifecrowd,2,1,3,6,5,5,7,5,5,,
372287,jake-mintz,7.9E+016,jakemintz,Does anyone have a dinner or food delivery service recommendation? GrubHub doesn't have a lot of selections in Mountain View.,bump-technologies,5,5,5,3,3,4,2,4,4,,
373612,jake-mintz,1826588136,jakemintz,Audio: Fleet Foxes - Drops in the River Fleet foxes make me so happy. bijan: http://tumblr.com/xue1sxmcd,bump-technologies,4,2,4,6,4,4,7,5,4,,
373829,jake-mintz,1244988201,jakemintz,One of the best and most concise articles I have seen on entrepreneurship. Thanks Paul Graham! http://bit.ly/X642x,bump-technologies,6,3,4,7,4,4,6,7,4,,
373874,jake-mintz,1107297671,jakemintz,is pretending to recruit for investment banking for the day.,bump-technologies,7,7,5,5,6,4,7,6,5,,
375463,jakub-nesetril,2.56E+017,jakubnesetril,Oh this is weird but cute: http://t.co/xLKvXE4i makes a web server out o any browser. Just like that! (via web sockets and reverse proxy),apiary,8,7,6,7,4,5,5,6,5,,
377411,jame-bracy,3.85E+016,waratuman,"Jon spills beer every time, without fail.",42floors,5,6,7,2,4,4,8,9,8,,
377590,jame-bracy,999654303,waratuman,studying,42floors,1,3,2,3,4,2,4,2,2,,
380848,james-giang,18900527187,jamesgiang,Chilling at #momomelb. Met the marketing director of RIM,venuemob,2,5,4,2,4,4,1,1,3,,
381295,james-giang,13419417355,jamesgiang,Invisible Shield!: http://wp.me/pyE8a-38,venuemob,2,2,3,2,1,3,2,1,3,,
382097,james-mcdermott,3.29E+017,jamesnmcdermott,The Data-Driven Enterprise Marketing Revolution http://t.co/cmKzitge0w,lytics,7,7,7,4,3,5,4,3,5,,
382369,james-mcdermott,1.22E+017,jamesnmcdermott,Couldn't agree more - good design is a strategic advantage today, maybe THE strategic advantage. http://t.co/p7YqS41L,lytics,3,3,4,6,4,5,7,5,4,
386015,james-varga,2.97E+017,jamesvarga,"I'm at The Tea Building (Shoreditch, London) http://t.co/MydjqhQA",miicard,2,3,4,6,4,5,3,5,4,,
386167,james-varga,2.3E+017,jamesvarga,Former RBS tech chief joins MiiCard - Business - http://t.co/3mL7vWo5: http://t.co/ZDOhPqZG,miicard,5,4,6,5,4,5,6,7,5,,
386879,james-varga,2.98E+016,jamesvarga,Anyone else get a #ringgo parking ticket when you've paid for parking? Is there something I'm missing?,miicard,2,5,3,7,6,8,2,1,3,,
386945,james-varga,28794519242,jamesvarga,eME needed digital identity to get traction  #innotribe and are targeting b2b with swift.  glad we have that sorted for b2c -  #sibos,miicard,6,6,6,6,5,5,3,2,4,,
387821,james-varga,1020673046,jamesvarga,4 cups of coffee and only just starting to wake up,miicard,5,6,5,2,4,5,5,6,5,,
389712,james-yu,4.56E+016,jamesjyu,Day 4 without coffee. It's getting better.,parse,6,6,7,8,6,7,7,6,8,,
390317,james-yu,3200000000000000,jamesjyu,F'ing ridiculous CPU built in minecraft http://www.minecraftforum.net/viewtopic.php?f=35&t=69299,parse,5,8,5,3,5,5,5,7,5,,
390719,james-yu,17756566644,jamesjyu,"Very happy. Found great trad italian food at quartino. Smokey clams, rich pork ravioli with speck, bright roasted beets with fresh ricotta.",parse,7,9,6,3,2,5,3,6,4,,
392322,jamie-murai,1833403846,jamiemurai,"Hit up the hydrocut earlier today, and saw Star Trek tonight. Overall, a really good long weekend.",pair,3,3,2,6,5,3,6,4,3,,
392359,jamie-murai,1461067533,jamiemurai,"and not only that, but Mint informed me that she's using IE, when I clearly remember telling her to only use Firefox.",pair,6,6,6,9,9,8,7,6,5,,
395884,jan-moravec,1.22E+017,janmoravec,Your $300 shirt is worth nothing as long as it hasn't your company logo on. #sw11underground,apiary,7,9,6,7,5,5,3,3,4,,
396374,jan-moravec,2.42E+016,janmoravec,Designing a responsive webapp for standard and touch devices from scratch is awesome job. Can't wait to have first prototype. #UI #UX #in,apiary,2,1,3,5,6,5,7,4,5,,
396626,jan-moravec,14368436829,janmoravec,What's better than typography? ??? Yes! More typography! http://bit.ly/aMJOcT Google Font Directory is here.,apiary,2,3,5,3,2,5,6,7,5,,
397482,jane-chung,4.67E+017,jchung02,"Move out of my sun, baby. -Fiona??? http://t.co/5SaReJUKQZ",klooff,1,3,4,3,1,4,4,4,4,,
398397,jane-chung,25043834314,jchung02,"I'm at iCrossing Los Angeles (12910 Culver Blvd., Los Angeles). http://4sq.com/awzkHo",klooff,3,4,3,7,6,5,6,5,3,,
398765,jane-chung,1191184774,jchung02,maybe anything you're afraid is exactly what you should do.,klooff,5,4,6,6,7,5,1,2,4,,
398968,jared-heyman,1.71E+017,jaredheyman,I just ate $5 worth of steamed sea bass at a street-side dive in Bangkok good enough to put any 5 star restaurant back home to shame.,crowdmed,3,5,4,6,4,5,4,5,5,,
401625,jarrett-streebin,7.97E+016,jstreebin,BikeBoy: Cows at the Dauphine http://bit.ly/mm2BX8,easypost,2,3,4,6,3,4,6,5,4,,
401958,jarrett-streebin,6.98E+016,jstreebin,Team cars out front  http://yfrog.com/h3leejnj,easypost,2,4,5,6,6,5,8,6,5,,
402427,jarrett-streebin,29536393037,jstreebin,Koppenbergcross and Foot Bags http://bit.ly/bqqxgT,easypost,1,2,1,2,3,1,2,4,1,,
402743,jarrett-streebin,13689979667,jstreebin,neighbors have #edge carbon wheels. it's a good neighborhood!,easypost,1,2,1,6,5,5,5,6,4,,
404911,jason-bornhorst,3.43E+017,jbornhorst,Well written article &amp, HN discussion on state of startup industry | Are coders worth it? | Hacker News http://t.co/oYnwOxh5AH,filament-labs,5,7,5,7,6,6,9,8,8,
406349,jason-freedman,8.4E+016,jasonfreedman,I want to get better at SEO--anyone willing to give me a 30-minute lesson? I'll return the favor in some way.,42floors,2,4,6,4,4,5,3,5,4,,
407863,jason-novek,1707843516,jnovek,"A Slax thumb drive with merb, NetBeans and Firefox took 12 Slax packages and 500 MB.  I had to install rubygems, NetBeans and merb by hand.",onlocal,5,7,6,6,6,5,3,4,4,,
408059,jason-novek,1059695392,jnovek,"""Heroes"" lives and ""Pushing Daisies"" dies.  We live in a twisted world.",onlocal,2,4,3,8,9,6,6,9,7,,
408464,jason-oberfest,922252091,joberfest,Why isn't all the music feedback I've given Pandora over the yrs portable in the event they go under?,mango-health,9,8,6,4,3,5,7,6,5,,
408502,jason-sosa,5.31E+017,jason_sosa,How Google Works http://t.co/RGVOFAorPS,immersive-labs,4,6,6,6,4,5,5,6,5,,
408715,jason-sosa,3.89E+017,jason_sosa,"I'm at LaGuardia Airport (LGA) (East Elmhurst, NY) w/ 177 others http://t.co/nPVWYwmBZx",immersive-labs,8,6,4,4,5,3,6,4,4,,
408727,jason-sosa,3.86E+017,jason_sosa,Facebook Building Major Artificial Intelligence System To Understand... http://t.co/HnMuTkCaPl,immersive-labs,5,5,6,7,6,5,8,7,5,,
408916,jason-sosa,2.41E+017,jason_sosa,Where Effective CEOs Spend Their Time http://t.co/P8Dh6dNb,immersive-labs,2,2,6,8,6,7,5,4,7,,
408946,jason-sosa,2.34E+017,jason_sosa,"Etail Innovations Blur Line Between Physical, Online Shopping  http://t.co/LuuidSZQ #qr",immersive-labs,5,4,4,7,5,5,6,8,6,,
409441,jason-sosa,1.16E+017,jason_sosa,"I'm at TechStars HQ (841 Broadway, 8th fl, New York) w/ 2 others http://t.co/ClvDufHD",immersive-labs,6,7,6,3,6,4,5,6,4,,
410446,jason-wang-2,1.08E+017,_jasonwang,"ARRRGGG, don't you hate it when you are working with an API and it just doesn't do what it's suppose to?",truevault,4,8,6,7,5,5,6,7,4,,
410553,jason-wang-2,10054558620,_jasonwang,Conan Finally Follows Someone On Twitter: A Random Woman Who Likes Peanut Butter. http://techcrunch.com/2010/03/05/conan-obrien-twitter/,truevault,2,5,3,5,6,3,6,5,3,,
414835,jean-franois-chianetta,9.54E+016,AugmenteDev,"I wish there would be a way to contact people that let comments on #Android #Market saying ""it doesn't work"" to ask them what doesn't work.",augment,2,5,4,6,5,4,6,8,4,,
414971,jeeyun-kim,5.04E+017,jeeyunkim,Photo: fox-demon is watching you http://t.co/N2wmO7H9tR,crittercism,4,2,6,3,1,5,6,4,5,,
415284,jeeyun-kim,1.29E+017,jeeyunkim,Aaaand meanwhile in Oakland there's tear gassing and flipping out. What a surprise,crittercism,5,4,6,4,2,5,3,3,4,,
415567,jeff-carbonella,8.54E+016,jeffcarbs,oldie but a goodie http://t.co/A6KhClx,contactually,2,6,6,1,2,3,3,4,6,,
416533,jeff-magnusson,4.93E+017,jmagnuss,My son is nearly as clever as a crow. ???Crows can perform as well as 7- to 10-year-olds on cause-and-effect tasks http://t.co/cuWkM1A2Mg???,playerize,6,6,4,4,2,3,5,8,7,,
416877,jeff-magnusson,4.2E+017,jmagnuss,"Answer by Marsha Browne to What is the best advice that anyone has ever given you: Stop Saying ""But"".  http://t.co/0ZRHKiaER7",playerize,2,4,6,6,4,5,2,2,4,,
416963,jeff-magnusson,3.93E+017,jmagnuss,"I've discovered the fastest way to have me abandon a parenting article is the phrase ""if the Bible is to be a guide...""",playerize,2,3,4,6,4,5,3,5,4,,
417341,jeff-magnusson,2.94E+017,jmagnuss,"When Dade Murphy (Zero Cool to you noobs) took a job at Goldman Sachs in 2006 in the HFT department, he wore this: http://t.co/6mW6oQRg",playerize,5,7,6,8,4,5,4,2,5,,
417742,jeff-magnusson,5.23E+016,jmagnuss,I love NASA: guidelines from the Color Usage Lab: http://awe.sm/5HRry #ui,playerize,7,8,6,8,7,5,5,4,5,,
417978,jeff-magnusson,28430463179,jmagnuss,"That quote was Sam Geist (The Outdoor Store), not me.",playerize,6,8,6,5,5,5,9,7,6,,
418994,jeffrey-byun,1710697222,jeffbyun,sun.  i see the sun!,orderahead,1,4,2,1,2,2,1,3,2,,
420588,jeffrey-rosen-2,4.12E+017,Wolfire,These are also brilliant books for learning figure drawing: http://t.co/yc11mxwJ2A,humble-bundle,2,4,4,6,7,4,7,8,6,,
428191,jeremy-mims,3.55E+017,jeremymims,"I'm at Dallas/Fort Worth International Airport (DFW) (DFW Airport, TX) w/ 46 others http://t.co/fVh5bCmNDa",onlocal,3,5,4,7,4,6,5,7,6,,
428214,jeremy-mims,3.53E+017,jeremymims,Turns out Snapchat is rather brilliant. A window into someone's life for a few seconds is like looking into a magic mirror or crystal ball.,onlocal,6,4,5,7,8,6,7,5,5,,
428473,jeremy-mims,3.27E+017,jeremymims,Um... Magic. http://t.co/WHw3hcWxNw,onlocal,2,5,3,8,8,8,8,6,7,,
428855,jeremy-mims,25100348477,jeremymims,New blog post: Special Sections http://ow.ly/195TnU,onlocal,4,7,5,4,1,2,2,2,2,,
429049,jeremy-mims,2454145198,jeremymims,This dog sings the jazz music http://post.ly/14r2,onlocal,6,7,7,8,7,8,7,7,8,,
429302,jeremy-mims,1173958861,jeremymims,mint.com says that the average New Yorker dropped their avg. dining out expenditures from $550/month in Nov/Dec to $300 in Jan. Recession...,onlocal,2,3,4,9,8,6,5,3,4,,
432680,jerry-jao,3.9E+017,RetentionSci,The Secret to Supersized Customer Service - http://t.co/dWEUXQsGx8,retention-science,5,7,6,7,6,5,7,5,5,,
434365,jessica-greenwalt,5.44E+017,jessgreenwalt,Health care expenditures for employees with high stress were 46% more than at similar organizations w/o high stress http://t.co/uP8KqJDT3L,crowdmed,2,4,3,3,5,4,2,4,3,,
434895,jessica-mah,5034658860,JessicaMah,College is good... I came up with a prototype concept for unique technology for Indinero thanks to my artificial intelligence class.,indinero,2,2,3,5,5,5,3,2,4,,
435863,jessica-nam-kim,3.52E+017,JessicaNamKim,Wow. It IS good to shut off for a while. Feeling refreshed. #vacation #familytravel,babbaco,5,4,6,7,6,5,6,5,4,,
436541,jessica-richman,5.09E+017,jessicarichman,Practice being proud. http://t.co/t6Vn0VzUaG #laurahershey,ubiome,2,3,4,2,3,4,2,4,4,,
439139,jim-eberlin,3.88E+017,jeberlin,A Complete Customer Success Platform -&gt, see how it works http://t.co/1OurYVJSYz #Demo #CEM #CustomerSuccess,jbara-software,5,6,4,4,3,5,5,7,6,
439260,jim-eberlin,3.56E+017,jeberlin,Interested in analyzing customer #churn &amp, impact on revenue? Check out our Revenue management module http://t.co/ansc1gogqi #LifeTimeValue,jbara-software,2,1,3,5,6,4,5,4,3,
439266,jim-eberlin,3.54E+017,jeberlin,Need the ability to intelligently forecast renewals?  Consider #Gainsight's Growth Management Module http://t.co/jRC0D1Byez,jbara-software,7,7,6,6,4,6,6,5,6,,
439508,jim-eberlin,2.89E+017,jeberlin,#Entrepreneur - the benefit of weekly meetings to sit down and hash out issues Vs email and text messages http://t.co/NytgOLrh,jbara-software,6,5,6,6,7,5,4,3,5,,
439710,jim-eberlin,2.31E+017,jeberlin,"#Entrepreneur - Article on ""Taking Control of Progress"" http://t.co/KolYD3tp 10 key points to remember",jbara-software,5,4,6,4,2,5,7,5,5,,
439710.1,jim-eberlin,2.31E+017,jeberlin,"#Entrepreneur - Article on ""Taking Control of Progress"" http://t.co/KolYD3tp 10 key points to remember",jbara-software,6,5,6,6,4,5,8,9,9,,
441962,jim-franklin,7594790318,jimfranklin,WSJ.com - Undressing the Terror Threat http://on.wsj.com/5Mrriu,sendgrid,2,3,4,4,6,5,5,4,5,,
